{
  "598": {
    "tagDate": ["1855-01-01T00:00:00.000Z"],
    "tagDescription": [
      "Extract - New York Albion - Pronunciamento of the New York Chamber of Commerce re Case of Bark Maury - Editorial comment. (See also Goodhue & Co. Corr. 16/11/1855)"
    ]
  },
  "754": {
    "tagDescription": [
      "Newspaper Extract (New Orleans) - Monetary and Financial Statement (in detail)"
    ],
    "tagDate": ["1856-12-31T00:00:00.000Z"]
  },
  "974": {
    "tagDate": ["1859-07-05T00:00:00.000Z"],
    "tagDescription": [
      "Newspaper Extract - Re. The Condition of Mexico. (Taken from 5/7/1859 A.D.M. Corr.)"
    ]
  },
  "442": {
    "tagDate": ["1855-02-08T00:00:00.000Z"],
    "tagDescription": [
      "Circular - Information re cost &c. of running a Steamer on the route between Australia and Panama."
    ]
  },
  "435": {
    "tagDate": ["1855-01-24T00:00:00.000Z"],
    "tagDescription": [
      "Newspaper Extract - Commerce of the United States - Imports into and Exports from United States to Foreign Ports. (Taken from 24/1/1855 G.M. & Co. Corr.)"
    ]
  },
  "618": {
    "tagDescription": [
      "Journal of Commerce - Extract - Review of the Market for week ending 15/1/1856. (Taken from 18/1/1856 \"French Order\")."
    ],
    "tagDate": ["1856-01-15T00:00:00.000Z"]
  },
  "139": {
    "tagDate": ["1853-10-03T00:00:00.000Z"],
    "tagDescription": [
      "Newspaper Extract - Financial Affairs. (Taken from 4/10/1853 O. Corr.)"
    ]
  },
  "1253": {
    "tagDescription": [
      "Newspaper Extract - The Merrimac withdrawn from Fortress Monroe. (Taken from 6/5/1862 L. & Co. Corr.)"
    ],
    "tagDate": ["1862-05-04T00:00:00.000Z"]
  },
  "256": {
    "tagDate": ["1854-03-07T00:00:00.000Z"],
    "tagDescription": [
      "Newspaper Extract - Advertisement for two millions of Loan for Baltimore and Ohio Railroad. Sgd/ J. Smith Hollins Joshua Vansant Wm. George Baker (Taken from 13/3/1854 O. Corr.) Commissioners of Finance."
    ]
  },
  "1237": {
    "tagDate": ["1862-02-22T00:00:00.000Z"],
    "tagDescription": [
      "Newspaper Extract - Re. payment in coin of Interest on Confederate Bonds. (Taken from 4/4/1862 L. & Co. Corr.)"
    ]
  },
  "796": {
    "tagDescription": [
      "Newspaper Extract - Imports of Dry Goods entered for consumption - withdrawn from Warehouse - entered for warehouse - 1855-6-7."
    ],
    "tagDate": ["1857-07-01T00:00:00.000Z"]
  },
  "899": {
    "tagDate": ["1858-06-28T00:00:00.000Z"],
    "tagDescription": [
      "Circular - Issued to the Shareholders of the Illinois Central Rail Road Company, calling in an assessment of $20 per share - Sgd/ J.N. Perkin, Treasurer. (Taken from 29/6/1858 W.C. & Co.)"
    ]
  },
  "748": {
    "tagDescription": [
      "Newspaper Extract - Baltimore & Ohio Annual Report. (Taken from 25/10/1856 W.C. & Co. Corr.)"
    ],
    "tagDate": ["1856-10-25T00:00:00.000Z"]
  },
  "750": {
    "tagDescription": [
      "The Daily Dispatch (15/11/1856) - Extract - Virginia State Finances; Sgd/ George W. Clutter, Auditor P.A. His Excellency H.A. Wise, Governor Va. (Taken from 17/11/1856 W.C. & Co. Corr.)"
    ],
    "tagDate": ["1856-11-11T00:00:00.000Z"]
  },
  "1118": {
    "tagDescription": [
      "Newspaper Extract - Letter from general Patterson dated at Harper's Ferry showing that his force could not be relied on. (Taken from 26/7/1861 L. & Co. Corr.)"
    ],
    "tagDate": ["1861-07-22T00:00:00.000Z"]
  },
  "81": {
    "tagDescription": [
      "Newspaper Extract - Bank Returns. (Taken from 23/8/1853 O. Corr.)"
    ],
    "tagDate": ["1853-08-23T00:00:00.000Z"]
  },
  "970": {
    "tagDate": ["1859-06-03T00:00:00.000Z"],
    "tagDescription": [
      "Newspaper Extract - New Orleans - Monetary and Financial., (Taken from 6/6/1859 E.J.F. Corr.)"
    ]
  },
  "1274": {
    "tagDescription": [
      "Montreal Weekly Herald - The Times on Canadian Defences - Letter to the Montreal Herald signed Veritas, commenting on Article. The Times on Canada from the issue of 6/6/1862"
    ],
    "tagDate": ["1862-06-28T00:00:00.000Z"]
  },
  "943": {
    "tagDescription": [
      "Newspaper Extract - Re. expected Report of Hon. Wm. M. Churchwell of Tennessee, a secret agent of the United States Government to Mexico to make examination of the true condition of affairs there. (Taken from 15/3/1859 A.D. Mann Corr.)"
    ],
    "tagDate": ["1859-02-07T00:00:00.000Z"]
  },
  "67": {
    "tagDate": ["1853-07-30T00:00:00.000Z"],
    "tagDescription": ["Statement of the Banks in New Orleans."]
  },
  "262": {
    "tagDate": ["1854-03-13T00:00:00.000Z"],
    "tagDescription": [
      "Newspaper Extract - Abstract of a portion of The Treasury Department Report - Amount of State Bonds outstanding and amount held by foreigners &c. (Taken from 13/3/1854 O. Corr.)"
    ]
  },
  "439": {
    "tagDescription": [
      "Nova Scotia - Report of the Railway Board Sgd/ Joseph Howe J. McCully Wm. Pryor, Jr. P.M. Cunningham J.H. Anderson Thos. S. Tobin."
    ],
    "tagDate": ["1855-02-06T00:00:00.000Z"]
  },
  "1126": {
    "tagDescription": [
      "Newspaper Extract - Southern account of the engagement near Manassas Junction - The number engaged - The Battle - The Loss - The Prisoners - The Booty. (Taken from 26/7/1861 L. & Co. Corr.)"
    ],
    "tagDate": ["1861-07-26T00:00:00.000Z"]
  },
  "334": {
    "tagDate": ["1854-06-23T00:00:00.000Z"],
    "tagDescription": ["Copy of Nova Scotia Debenture."]
  },
  "70": {
    "tagDescription": [
      "Statement - Mobile and Ohio Railroad - Sgd/ John Childe, Chief Engineer and General Agent."
    ],
    "tagDate": ["1853-08-10T00:00:00.000Z"]
  },
  "1145": {
    "tagDate": ["1861-08-19T00:00:00.000Z"],
    "tagDescription": [
      "Newspaper Extract - General Order issued to the Governors of the Federal States re. forwarding to Washington all volunteer regiments or parts of regiments &c. Sgd/ Simon Cameron, Secretary of War. (Taken from 19/8/1861 L. & Co. Corr.)"
    ]
  },
  "1293": {
    "tagDescription": [
      "Richmond Whig - (1) Extract - The Six Days' Combat (along the Chickahoming) The Richmond Christian Advocate. (2) Extract - same subject. (Taken from 12/8/1862 L. & Co. Corr.)"
    ],
    "tagDate": ["1862-08-12T00:00:00.000Z"]
  },
  "388": {
    "tagDate": ["1854-12-30T00:00:00.000Z"],
    "tagDescription": [
      "Circular - Decoppet & Co., Stock & Exchange Brokers, New York - Rail Road Bonds &c."
    ]
  },
  "1206": {
    "tagDescription": [
      "Newspaper Extract - The Proclamation of General Phelps of Massachusetts to the people of the Southwest after landing at the mouth of the Mississippi. (Taken from 23/12/1861 L. & Co. Corr.)"
    ],
    "tagDate": ["1861-12-04T00:00:00.000Z"]
  },
  "1019": {
    "tagDate": ["1860-01-31T00:00:00.000Z"],
    "tagDescription": [
      "Newspaper Extract - Our Inter-Continental Policy - (Taken from 31/1/1860 A.D.M. Corr.)"
    ]
  },
  "381": {
    "tagDescription": [
      "Newspaper Extracts - Eastern Rail Road Directors' Notice of the issue of $750,000 Bonds of the Company - Sgd/ Albert Thorndike Isaiah Breed David A. Neal Ichabod Goodwin Samuel Hooper Micajah Lunt (Taken from 19/11/1854 O. Corr.) Directors."
    ],
    "tagDate": ["1854-11-16T00:00:00.000Z"]
  },
  "1105": {
    "tagDescription": [
      "The Sun, Baltimore - Extract - The President's Message to the coming Congress - Rumours regarding its essential points. (Taken from 28/6/1861 L. & Co. Corr.)"
    ],
    "tagDate": ["1861-06-28T00:00:00.000Z"]
  },
  "1246": {
    "tagDescription": [
      "Newspaper Extract - Provincial Parliament, Quebec - Legislative Council - Legislative Assembly."
    ],
    "tagDate": ["1862-03-20T00:00:00.000Z"]
  },
  "1225": {
    "tagDate": ["1862-01-07T00:00:00.000Z"],
    "tagDescription": [
      "Newspaper Extract - Memo addressed to the Editors of the Journal of Commerce, signed P. annexing extracts showing the treaty stipulations between United States and Great Britain in regard to private rights of property in case of war. (Taken from 7/1/1862 G.M. & Co. Corr.)"
    ]
  },
  "167": {
    "tagDate": ["1853-11-10T00:00:00.000Z"],
    "tagDescription": [
      "Report of the Lieut. Governor Sir G. Le Marchant on the State Resources and capabilities of Nova Scotia, dated 28/10/1853."
    ]
  },
  "76": {
    "tagDate": ["1853-08-22T00:00:00.000Z"],
    "tagDescription": [
      "Newspaper Extract - Treasury Circular notice to holders of the six per cent stocks redeemable 1862. (Taken from 23/8/1853 O. Corr.)"
    ]
  },
  "37": {
    "tagDate": ["1853-05-17T00:00:00.000Z"],
    "tagDescription": [
      "Newspaper Extract - Financial Affairs. (Taken from 17/5/1853 O. Corr.)"
    ]
  },
  "634": {
    "tagDescription": [
      "Circular - Commercial Statistics for the Hawaiian Islands for the year ending 31/12/1855. Sgd/ B.F. Snow, Honolulu."
    ],
    "tagDate": ["1856-02-16T00:00:00.000Z"]
  },
  "557": {
    "tagDate": ["1855-01-01T00:00:00.000Z"],
    "tagDescription": [
      "La Providencia - (Insurance Slaves' Lives, Havana Cuba) - Prospectus and Articles of Constitution - Also La Hereditaria."
    ]
  },
  "541": {
    "tagDate": ["1855-11-26T00:00:00.000Z"],
    "tagDescription": [
      "New York Times - Re purchase of Grain by English and French Governments."
    ]
  },
  "1058": {
    "tagDescription": [
      "Picayune - Extract - Important news from Mexico - Total rout of the Liberals. (Taken from 19/6/1860 A.D.M. Corr.)"
    ],
    "tagDate": ["1860-06-10T00:00:00.000Z"]
  },
  "316": {
    "tagDescription": [
      "Circular - Statement as to the Terre Haute & Alton Railroad, Dated April 1854."
    ],
    "tagDate": ["1854-05-11T00:00:00.000Z"]
  },
  "775": {
    "tagDate": ["1857-01-16T00:00:00.000Z"],
    "tagDescription": [
      "New York Courier and Enquirer. Extract copied from - Statement of the history and condition of those States in the Union which have found themselves embarrassed in meeting their liabilities (Taken from 20/1/1857 O.)"
    ]
  },
  "955": {
    "tagDescription": [
      "Newspaper Extract - Mexican Affairs - Re. British demonstration with respect to the coercion of the overdue interest on the Mexican bonds held by British subjects &c. (Taken from 2/5/1859 A.D.M. Corr.)"
    ],
    "tagDate": ["1859-04-28T00:00:00.000Z"]
  },
  "251": {
    "tagDate": ["1854-02-14T00:00:00.000Z"],
    "tagDescription": [
      "Newspaper Extract - The Message of the Governor of Illinois contains the following statement of the State Debt. (Taken from 14/2/1854 O. Corr.)"
    ]
  },
  "798": {
    "tagDate": ["1857-08-28T00:00:00.000Z"],
    "tagDescription": [
      "Circular - Re Ohio Life Insurance and Trust Company - Sgd/ James F. Meline & Co."
    ]
  },
  "637": {
    "tagDescription": [
      "Daily Advertiser, (Boston) - Extract - Editorial on Humours on War. (Taken from 21/3/1856 O.)"
    ],
    "tagDate": ["1856-03-21T00:00:00.000Z"]
  },
  "746": {
    "tagDescription": [
      "Circular - Sketch of Railroad earning in September - and an estimate of the results of the New York Central. (Taken form 25/10/1856 W.C. & Co. Corr.)"
    ],
    "tagDate": ["1856-10-20T00:00:00.000Z"]
  },
  "164": {
    "tagDate": ["1853-11-08T00:00:00.000Z"],
    "tagDescription": [
      "Newspaper Extract - Cotton exported from United States - Table giving quantities and values exported from the United States in 1851 and 1853. (Taken from 8/11/1853 O. Corr.)"
    ]
  },
  "337": {
    "tagDescription": [
      "Circular - Pennsylvania Rail Road Company - New Loan Sgd/ J. Edgar Thomson, President. (Taken from 25/7/1854 O. Corr.)"
    ],
    "tagDate": ["1854-06-28T00:00:00.000Z"]
  },
  "1292": {
    "tagDescription": [
      "Newspaper Extract - Story told Mr. Lincoln a propos the slavery emancipation question. (Taken from 12/8/1862 L. & Co. Corr.)"
    ],
    "tagDate": ["1862-08-12T00:00:00.000Z"]
  },
  "1199": {
    "tagDate": ["1861-11-01T00:00:00.000Z"],
    "tagDescription": [
      "Newspaper Extract - Report of Adjutant General Thomas who was with the Secretary of War during his visit to Missouri. (Taken from 1/11/1861 L. & Co. Corr.)"
    ]
  },
  "550": {
    "tagDate": ["1855-12-31T00:00:00.000Z"],
    "tagDescription": [
      "Newspaper Extract - Review of the market, for week ending 31/12/1855. (Taken from 2/1/1856 \"French Order\")"
    ]
  },
  "258": {
    "tagDescription": [
      "Newspaper Extract - Proposals for $2,000,000 of the Loan authorized by the City of Baltimore - Office of the Commissioners of Finance. Sgd/ J. Smith Hollins Joshua Vansant Wm. George Baker (Taken from 7/3/1854 O. & L. Corr.) Commissioners of Finance."
    ],
    "tagDate": ["1854-03-07T00:00:00.000Z"]
  },
  "821": {
    "tagDate": ["1857-12-12T00:00:00.000Z"],
    "tagDescription": [
      "Newspaper Extract - Table of the Loan, Specie, Circulation and Deposits of the Banks of the City of New York for the week ending on Saturday, December 12, 1857, to which is affixed the Capital of each Bank. (Taken from 15/12/1857 W.C. & Co. Corr.)"
    ]
  },
  "240": {
    "tagDate": ["1854-01-01T00:00:00.000Z"],
    "tagDescription": [
      "Circular - Statistics of the Gold-Fields of Victoria (Australia for the years 1853 - Sgd/ Edward Khulle)"
    ]
  },
  "982": {
    "tagDescription": [
      "The States - Extract - Ecclesiastical Reform in Mexico. (Taken from 13/9/1859 A.D.M. Corr.)"
    ],
    "tagDate": ["1859-09-09T00:00:00.000Z"]
  },
  "548": {
    "tagDate": ["1855-12-24T00:00:00.000Z"],
    "tagDescription": [
      "New York Times - Extract - Debt and Railway System of Missouri. (Taken from 15/9/1856 M.)"
    ]
  },
  "1168": {
    "tagDate": ["1861-10-14T00:00:00.000Z"],
    "tagDescription": [
      "Newspaper Extract - Important Circular from the Secretary of State, relative to the Defence of the Atlantic and Lake Coasts. (Taken from 8/10/1861 L.& Co.Corr.)"
    ]
  },
  "492": {
    "tagDescription": [
      "Newspaper Extract - Article \"Ponderosity of the City Debt\" (Boston) Sgd/ An Old Citizen. (Taken from 31/7/1855 O. Corr.)"
    ],
    "tagDate": ["1855-07-31T00:00:00.000Z"]
  },
  "369": {
    "tagDate": ["1854-09-05T00:00:00.000Z"],
    "tagDescription": [
      "American Railroad Journal - Extract re. Henderson and Nashville Railroad. (See Corr. Ward, Campbell & Co. 1854)"
    ]
  },
  "959": {
    "tagDescription": [
      "Newspaper Extract - The condition of Mexico - Caligula Miramon. The triumph of the Liberalists a necessity for the honour and welfare of the United States - Attitude of Great Britain. (Taken from 10/5/1859 A.D.M. Corr.)"
    ],
    "tagDate": ["1859-05-07T00:00:00.000Z"]
  },
  "464": {
    "tagDescription": [
      "Newspaper Extract - (Mexico) - Re. establishment of Line of Steamers from Liverpool to Tampico and Vera Cruz. (Taken from 7/7/1855 F. de P.F. Corr.)"
    ],
    "tagDate": ["1855-04-13T00:00:00.000Z"]
  },
  "113": {
    "tagDescription": [
      "United States Economist, Wheat Prospects - Corn Trade. (Taken from 13/9/1853 O. Corr.)"
    ],
    "tagDate": ["1853-09-10T00:00:00.000Z"]
  },
  "1098": {
    "tagDescription": [
      "Newspaper Extract - Proceedings in the United States District by Chief Justice Taney of the United States Supreme Court in the Habeas Corpus case of John Merryman. Recorded opinion of the Chief Justice filed with the Clerk of the Court. (Taken from 31/5/1861 L. & Co. Corr.)"
    ],
    "tagDate": ["1861-05-28T00:00:00.000Z"]
  },
  "609": {
    "tagDate": ["1855-01-01T00:00:00.000Z"],
    "tagDescription": [
      "Circular - Freight - Alfred Laming & Co. Ship & Insurance Brokers and Steam Agents."
    ]
  },
  "1069": {
    "tagDate": ["1860-12-09T00:00:00.000Z"],
    "tagDescription": [
      "Newspaper Extract - Discusses the caucus of Southern Senators. (Taken from 9/12/1860 W.B. Reed Corr.)"
    ]
  },
  "1244": {
    "tagDate": ["1862-03-14T00:00:00.000Z"],
    "tagDescription": [
      "North American - Extract - Editorial comment on the evacuation of Manassas. (Taken from 14/3/1862 W.B. Reed, Corr.)"
    ]
  },
  "1101": {
    "tagDate": ["1861-06-21T00:00:00.000Z"],
    "tagDescription": [
      "Newspaper Extract (From the Memphis Bulletin) - General Pillow proclaims all Northern Property confiscated. - Sgd/ Maj.-Gen. Pillow - By Order of Daniel S. Donelson, Adj.-Gen. (Taken from 17/7/1861 W.C. & Co.)"
    ]
  },
  "50": {
    "tagDate": ["1853-07-01T00:00:00.000Z"],
    "tagDescription": [
      "Boston City Bond, Model £100 Sterling, Redeemable 1878. (Taken from 28/6/1853 O. Corr.)"
    ]
  },
  "1204": {
    "tagDescription": [
      "From the Washington Correspondent of Chicago Times - Sharp skirmishes and Federal Losses across the Potomac, (Taken from 9/12/1861 L. & Co. Corr.)"
    ],
    "tagDate": ["1861-11-30T00:00:00.000Z"]
  },
  "192": {
    "tagDescription": [
      "Newspaper Extract - Money Market (Taken from 6/12/1853 O. Corr.)"
    ],
    "tagDate": ["1853-12-06T00:00:00.000Z"]
  },
  "1141": {
    "tagDate": ["1861-08-16T00:00:00.000Z"],
    "tagDescription": [
      "Newspaper Extract - President Lincoln's proclamation to seize Confederate Ships. (Taken from 19/8/1861 L. & Co. Corr.)"
    ]
  },
  "1252": {
    "tagDate": ["1862-04-14T00:00:00.000Z"],
    "tagDescription": [
      "Newspaper Extract - Re. Bishop Whittingham's Thanksgiving Prayer. (Taken from 14/4/1862 L. & Co. Corr.)"
    ]
  },
  "1159": {
    "tagDescription": [
      "Newspaper Extract - Re modification by Lincoln of Fremont's Proclamation. (Taken from 30/9/1861 L. & Co. Corr.)"
    ],
    "tagDate": ["1861-09-30T00:00:00.000Z"]
  },
  "386": {
    "tagDate": ["1854-12-04T00:00:00.000Z"],
    "tagDescription": [
      "Newspaper Extract - Re Bills of Exchange. (Taken from 22/1/1855 O. Corr.)"
    ]
  },
  "977": {
    "tagDescription": [
      "Newspaper Extract - Mexican Affairs. (Taken from 21/8/1859 A.D.M. Corr.)"
    ],
    "tagDate": ["1859-08-18T00:00:00.000Z"]
  },
  "1124": {
    "tagDate": ["1861-07-26T00:00:00.000Z"],
    "tagDescription": [
      "Newspaper Extract - Resolution of the Union Defence Committee. (Taken from 26/7/1861 L. & Co. Corr.)"
    ]
  },
  "460": {
    "tagDescription": [
      "Circular - Michigan Central Railroad Company - Extracts of substance of Contract with Joliet and Northern Indiana Railroad Company. (Taken from 28/3/1855 O. Corr.)"
    ],
    "tagDate": ["1855-03-24T00:00:00.000Z"]
  },
  "483": {
    "tagDescription": [
      "Newspaper Extract - Albany - New York Central Railroad - Statement of their receipts for the first four months of 1854 and 1855. Sgd/ C. Vibbard, Gen'l Supt. (Taken from 15/5/1855 O. Corr.)"
    ],
    "tagDate": ["1855-05-09T00:00:00.000Z"]
  },
  "669": {
    "tagDescription": [
      "Daily Advertiser, Boston - Extract - Continuation of Mr. Hale's account of the troubles in Nicaragua. (Taken from 13/6/1856 O.)"
    ],
    "tagDate": ["1856-06-13T00:00:00.000Z"]
  },
  "309": {
    "tagDescription": [
      "Circular - Michigan Southern & Northern Indiana Railroad Companies - (See Ward, Campbell & Co. Corr. 1854)."
    ],
    "tagDate": ["1854-04-11T00:00:00.000Z"]
  },
  "1020": {
    "tagDate": ["1860-01-31T00:00:00.000Z"],
    "tagDescription": [
      "Newspaper Extract - Comments on a communication from Hon. Wm. Appleton advising a movement for including the United States Government to offer its mediation in the quarrel between China and the Western powers.  (Taken from 31/1/1860 A.D.M. Corr.)"
    ]
  },
  "1236": {
    "tagDate": ["1862-02-22T00:00:00.000Z"],
    "tagDescription": [
      "Newspaper Extract - The Rebellion - News from Tennessee. (Taken from 1/3/1862 W.C. & Co. Corr.)"
    ]
  },
  "778": {
    "tagDescription": [
      "Circular - Blake, Howe & Co., Banks & Dealers in Exchange, Brokers & Negotiators of Stocks, Boston."
    ],
    "tagDate": ["1857-01-27T00:00:00.000Z"]
  },
  "1071": {
    "tagDate": ["1860-12-13T00:00:00.000Z"],
    "tagDescription": [
      "Circular - Statement of Claims against the Ohio and Mississippi Railroad Company (Eastern Division) Sgd/ Edwin Bartlett, Chairman of Trustees."
    ]
  },
  "958": {
    "tagDescription": [
      "Newspaper Extract - Mr. Belly's Canal enterprise in Nicaragua arouses opposition on account of the exorbitant privileges accorded. (Taken from 2/5/1859 A.D.M. Corr.)"
    ],
    "tagDate": ["1859-05-02T00:00:00.000Z"]
  },
  "368": {
    "tagDescription": [
      "Newspaper Extract (Ohio) - The Production and Consumption of Wheat in the United States. Cereal Grains - Crops - Deficiencies and Surpluses of the Several States - Home Consumption - Internal Trade."
    ],
    "tagDate": ["1854-09-05T00:00:00.000Z"]
  },
  "1088": {
    "tagDescription": [
      "Circular - Report of the Hannibal and St. Joseph Railroad Company, addressed to the Bondholders. Sgd/ J.W. Brooks, Chairman of the Board. (Taken from 15/3/1861 O. Corr.)"
    ],
    "tagDate": ["1861-03-13T00:00:00.000Z"]
  },
  "86": {
    "tagDate": ["1853-08-27T00:00:00.000Z"],
    "tagDescription": [
      "Daily Advertiser, Boston - Editorial on Mississippi Bonds. (Taken from 31/8/1853 O. Corr.)"
    ]
  },
  "795": {
    "tagDate": ["1857-07-01T00:00:00.000Z"],
    "tagDescription": [
      "Newspaper Extract - Abstract of the Tariff Bill. (Taken from 6/3/1857 O.)"
    ]
  },
  "940": {
    "tagDate": ["1859-01-24T00:00:00.000Z"],
    "tagDescription": [
      "Newspaper Extract - The Government Loan - Names of Bidders - Amount offered - Rates of Premium. (Taken from 25/1/1859 O.)"
    ]
  },
  "944": {
    "tagDescription": [
      "Newspaper Extract - Zuloaga has abdicated the presidency of Mexico, in favour of Miramon. (Taken from 15/3/1859 A.D. Mann. Corr.)"
    ],
    "tagDate": ["1859-02-12T00:00:00.000Z"]
  },
  "1263": {
    "tagDescription": [
      "Newspaper Extract - The account of the fate of the Merrimac. (Taken from 20/5/1862 L. & Co."
    ],
    "tagDate": ["1862-05-20T00:00:00.000Z"]
  },
  "78": {
    "tagDescription": [
      "Newspaper Extract - The State of Mississippi - The Union Bank Bonds - Highly important decision - (See also 12/8/1853 P.) (Taken from 23/8/1853 O. Corr.)"
    ],
    "tagDate": ["1853-08-23T00:00:00.000Z"]
  },
  "668": {
    "tagDate": ["1856-06-12T00:00:00.000Z"],
    "tagDescription": [
      "Daily Advertiser, Boston - Extract - The State of Affairs in Nicaragua (Mr. Hale's account) (Taken from 13/6/1856 O.)"
    ]
  },
  "1270": {
    "tagDescription": [
      "Newspaper Extract - President Lincoln's speech after his visit to General Scott at West Point. (Taken from 27/6/1862 L. & Co. Corr.)"
    ],
    "tagDate": ["1862-06-27T00:00:00.000Z"]
  },
  "545": {
    "tagDescription": [
      "Missouri Republican - Extract - An Act to secure the completion of certain railroads in Missouri. (Taken from 4/1/1856 O.)"
    ],
    "tagDate": ["1855-12-17T00:00:00.000Z"]
  },
  "1018": {
    "tagDescription": [
      "American and Gazette - Extract - Editorial - The New China War. (Taken from 31/1/1860 A.D.M. Corr.)"
    ],
    "tagDate": ["1860-01-26T00:00:00.000Z"]
  },
  "80": {
    "tagDescription": [
      "Newspaper Extract - Money Market - Remarks on Capital invested in Erie Railroad. (Taken from 23/8/1853 O. Corr.)"
    ],
    "tagDate": ["1853-08-23T00:00:00.000Z"]
  },
  "951": {
    "tagDescription": [
      "Royal Gazette Extra - Halifax, N.S. An Act to regulate the Customs Duties - Tables of Duties - Tables of Exemptions."
    ],
    "tagDate": ["1859-03-31T00:00:00.000Z"]
  },
  "436": {
    "tagDate": ["1855-02-01T00:00:00.000Z"],
    "tagDescription": [
      "Circular - Prices Current , Bacon Cheese, Beef, Port &c. Trimmer and Grainger Foreign Provision Brokers, London and Liverpool. (Taken from 2/2/1855 M. Corr.)"
    ]
  },
  "4": {
    "tagDescription": [
      "Copies of the Railway Bills passed by the Legislature of Nova Scotia."
    ],
    "tagDate": ["1853-04-28T00:00:00.000Z"]
  },
  "1135": {
    "tagDate": ["1861-08-03T00:00:00.000Z"],
    "tagDescription": [
      "Newspaper Extract - A Statement of facts as to the Police Commissioners of Baltimore. (Taken from 5/8/1861 L. & Co. Corr.)"
    ]
  },
  "117": {
    "tagDescription": [
      "Newspaper Extract - Foreign Dry Goods Market. (Taken from 20/9/1853 O. Corr.)"
    ],
    "tagDate": ["1853-09-16T00:00:00.000Z"]
  },
  "1127": {
    "tagDescription": [
      "Newspaper Extract - The necessity of a sure defence of Washington - setting forth the consequences of its fall. (Taken from 26/7/1861 W.B. Reed Corr.)"
    ],
    "tagDate": ["1861-07-26T00:00:00.000Z"]
  },
  "799": {
    "tagDate": ["1857-09-21T00:00:00.000Z"],
    "tagDescription": [
      "Circular Letter - Re object of the Welland Railway Company, to regain a fair proportion of the trade through Canada. Sgd/ Wm. Hamilton Merritt, Director of Welland R. Co. (Taken from 23/9/1857 Package marked Canada, N.B., N.S. & Quebec City."
    ]
  },
  "1212": {
    "tagDescription": [
      "Newspaper Extract - The Steamer Trent Affair - Supplemental Tariff Bill - (Taken from 24/12/1861 W.C. & Co. Corr.)"
    ],
    "tagDate": ["1861-12-23T00:00:00.000Z"]
  },
  "896": {
    "tagDate": ["1858-05-12T00:00:00.000Z"],
    "tagDescription": [
      "Newspaper Extract - Corporation of Quebec - A By-Law to provide Funds to meet the expenses of the City of Quebec &c. (Taken from 28/5/1858 Package marked Canada)"
    ]
  },
  "1119": {
    "tagDescription": [
      "Newspaper Extract (Baltimore) - Editorial Comment on the War from the Confederate view point. (Taken from 26/7/1861 L. & Co. Corr.)"
    ],
    "tagDate": ["1861-07-23T00:00:00.000Z"]
  },
  "1282": {
    "tagDate": ["1862-07-01T00:00:00.000Z"],
    "tagDescription": [
      "Newspaper Extract - Arrest of Mr. Charles C. Fulton, one of the Editors and proprietors of the Baltimore American. (Taken from 1/7/1862 L. & Co. Corr.)"
    ]
  },
  "1189": {
    "tagDate": ["1861-10-18T00:00:00.000Z"],
    "tagDescription": [
      "Newspaper Extract - Now and then - 1856 - 1860 - the feeling in the South. (Taken from 18/10/1861 L. & Co. Corr.)"
    ]
  },
  "753": {
    "tagDescription": [
      "Circular - Flour, Wheat, Indian Corn, Rye, Cotton &c. Sgd/ Wotherspoon, Kingsford & Co. Brokers (Taken from 24/12/1856 W.C. & Co. Corr.)"
    ],
    "tagDate": ["1856-12-23T00:00:00.000Z"]
  },
  "259": {
    "tagDate": ["1854-03-08T00:00:00.000Z"],
    "tagDescription": [
      "Newspaper Extracts - Results of an enquiry by the United States Treasury to ascertain the amount of American Securities held abroad. (See Ward, Campbell & Co. Corr. 1854)"
    ]
  },
  "973": {
    "tagDate": ["1859-06-13T00:00:00.000Z"],
    "tagDescription": [
      "Newspaper Extract - England preparing to follow the Lead of the United States in Mexican affairs. (Taken from 13/6/1859 A.D.M. Corr.)"
    ]
  },
  "487": {
    "tagDate": ["1855-05-21T00:00:00.000Z"],
    "tagDescription": [
      "Parchment - Commonwealth of Massachusetts - An Act to authorize the Western Railroad Corporation to issue Bonds."
    ]
  },
  "1247": {
    "tagDate": ["1862-03-21T00:00:00.000Z"],
    "tagDescription": [
      "Newspaper Extract - Condition of the Grand Trunk - What should Parliament do?"
    ]
  },
  "997": {
    "tagDate": ["1859-12-31T00:00:00.000Z"],
    "tagDescription": [
      "Circular - Conversion of The Public Debt of Canada 1860 - Sgd/ A.T. Galt, Minister of Finance of Canada (Taken from Package marked Canada &c.)"
    ]
  },
  "212": {
    "tagDescription": ["Form of receipt for Mississippi Bonds."],
    "tagDate": ["1853-01-01T00:00:00.000Z"]
  },
  "1131": {
    "tagDate": ["1861-08-01T00:00:00.000Z"],
    "tagDescription": [
      "Newspaper Extract - Modifications upon the Tariff Bill as reported to the House. (Taken from 2/8/1861 L. & Co. Corr.)"
    ]
  },
  "122": {
    "tagDate": ["1853-10-01T00:00:00.000Z"],
    "tagDescription": [
      "Newspaper Extract - New York City Banks weekly return. (Taken from 4/10/1853 O. Corr.)"
    ]
  },
  "1158": {
    "tagDescription": [
      "Newspaper Extracts - From Chicago Tribune and the St. Louis Democrat. (Taken from 30/9/1861 L. & Co. Corr.)"
    ],
    "tagDate": ["1861-09-30T00:00:00.000Z"]
  },
  "615": {
    "tagDate": ["1856-01-08T00:00:00.000Z"],
    "tagDescription": [
      "National Intelligencer - The President's Message - Editorial comments. (Taken from 15/1/1856 O.)"
    ]
  },
  "595": {
    "tagDescription": [
      "Newspaper Extract - Special Meeting of the New York Chamber of Commerce - Case of the Bark Maury. (See also Corr. Goodhue & Co. 16/11/1855)."
    ],
    "tagDate": ["1855-01-01T00:00:00.000Z"]
  },
  "578": {
    "tagDate": ["1855-01-01T00:00:00.000Z"],
    "tagDescription": [
      "Prospectus - The Guyandotte Land Coal and Iron Company - West Virginia, United States - Also Map of the 340,000 acres of land near The Ohio, in the valley of the Guyandotte River, Virginia, the property of this Company."
    ]
  },
  "403": {
    "tagDescription": [
      "Circular - Hempfield Railroad, Pennsylvania, United States."
    ],
    "tagDate": ["1854-01-01T00:00:00.000Z"]
  },
  "484": {
    "tagDate": ["1855-05-18T00:00:00.000Z"],
    "tagDescription": [
      "The Michigan Central Railroad - its history and resources - N.B.- Two drafts of this will be found in Misc. Corr. under same date."
    ]
  },
  "1283": {
    "tagDescription": [
      "Newspaper Extract - Mortality among Iowa Volunteers. (Taken from 1/7/1862 L. & Co. Corr.)"
    ],
    "tagDate": ["1862-07-01T00:00:00.000Z"]
  },
  "114": {
    "tagDescription": [
      "Circular - Cotton crop of the United States - Statement and Total amount for the year ending 31/8/1853."
    ],
    "tagDate": ["1853-09-10T00:00:00.000Z"]
  },
  "745": {
    "tagDescription": [
      "Newspaper Extract - The Grand Trunk Junction Company - The New European Subscription. (Taken from 5/9/1856 O.)"
    ],
    "tagDate": ["1856-09-05T00:00:00.000Z"]
  },
  "1099": {
    "tagDescription": [
      "Newspaper Extract - Comments upon the result of the Habeas Corpus case of John Merryman. (Taken from 31/5/1861 L. & Co. Corr.)"
    ],
    "tagDate": ["1861-05-31T00:00:00.000Z"]
  },
  "480": {
    "tagDate": ["1855-05-05T00:00:00.000Z"],
    "tagDescription": [
      "Newspaper Extract - Monetary & Financial (Louisiana and New Orleans) (Taken from 5/5/1855 E.J.F. Corr.)"
    ]
  },
  "463": {
    "tagDate": ["1855-04-09T00:00:00.000Z"],
    "tagDescription": [
      "Newspaper Extract - Vote on Bill to authorize State Scrip to the Vermont and Massachusetts Railroad. (Taken from 9/4/1855 O. Corr."
    ]
  },
  "431": {
    "tagDescription": [
      "Newspaper Extract - Cost of the States Agency - (Illinois) - Reply of Governor Matteson to a resolution of the Senate re financial transactions between himself as Governor and the State Agent, Julias Wadsworth. N.B.- See also 13/3/1855 P. (Taken from 30/1/1855 O. Corr.)"
    ],
    "tagDate": ["1855-01-19T00:00:00.000Z"]
  },
  "366": {
    "tagDescription": [
      "American Railroad Journal - Report of Henderson and Nashville Railroad. (Taken from 4/9/1854 O. Corr."
    ],
    "tagDate": ["1854-09-04T00:00:00.000Z"]
  },
  "776": {
    "tagDescription": [
      "Newspaper Extract - Mercantile Failures in the United States for the year 1856. (Taken from 20/1/1857 O.)"
    ],
    "tagDate": ["1857-01-20T00:00:00.000Z"]
  },
  "315": {
    "tagDate": ["1854-05-02T00:00:00.000Z"],
    "tagDescription": [
      "Newspaper Extract - Financial Affairs. (Taken from 2/5/1854 O. Corr.)"
    ]
  },
  "227": {
    "tagDescription": ["Newspaper Extract - Money Market."],
    "tagDate": ["1853-01-01T00:00:00.000Z"]
  },
  "1075": {
    "tagDate": ["1861-01-04T00:00:00.000Z"],
    "tagDescription": [
      "The Montreal Gazette - Extract - The First Bondholders of the Grand Trunk Company - Attempt to show that the concession of the security in Maine to the Bank of Upper Canada was of no value. (Taken from 18/1/1861 G.T.R.)"
    ]
  },
  "606": {
    "tagDate": ["1855-01-01T00:00:00.000Z"],
    "tagDescription": [
      "Supplement a la Circulaire de Marie & Kanz. Revue de 1855."
    ]
  },
  "1068": {
    "tagDescription": [
      "Newspaper Extract - Sacking of the English legation by officers of the Government of Mexico. (Taken from 4/12/1860 A.D.M. Corr.)"
    ],
    "tagDate": ["1860-12-04T00:00:00.000Z"]
  },
  "599": {
    "tagDescription": [
      "Prospectus - Chicago, Detroit and Canada Grand Trunk Junction Railroad Company. N.B.- Accompanying this is a Map showing the connection with the Chicago, Detroit, and Canada Grand Trunk Junction Railroad. (See Package marked Maps)."
    ],
    "tagDate": ["1855-01-01T00:00:00.000Z"]
  },
  "947": {
    "tagDate": ["1859-02-22T00:00:00.000Z"],
    "tagDescription": [
      "Newspaper Extract - Act of the Legislature of Illinois in relation to the public debt of that State. Sgd/ Wm. R. Morrison, Speaker of the House of Representatives, John Wood, Speaker of the Senate. (Taken from 29/3/1859 O.)"
    ]
  },
  "184": {
    "tagDescription": [
      "Commercial Reviews - Maclean, Maris & Co's London and Liverpool Prices Current. (Taken from 31/1/1854 O. Corr.)"
    ],
    "tagDate": ["1853-12-02T00:00:00.000Z"]
  },
  "1198": {
    "tagDescription": [
      "Newspaper Extract - Proceedings in the United States Court at Washington where the Habeas Corpus is suspended. (Taken from 1/11/1861 L. & Co. Corr.)"
    ],
    "tagDate": ["1861-11-01T00:00:00.000Z"]
  },
  "619": {
    "tagDate": ["1856-01-16T00:00:00.000Z"],
    "tagDescription": [
      "National Intelligencer - Extract - Virginia Debt and Stocks - Board of Works calls for Selden & Withers contracts. (Taken from 16/1/1856 O.)"
    ]
  },
  "1169": {
    "tagDate": ["1861-10-15T00:00:00.000Z"],
    "tagDescription": [
      "Pamphlet - Commonwealth of Massachusetts - Supreme Judicial Court - Wm. H. Swift, Baring Bros. & Co., Magniac Jardine & Co., Plaintiffs. vs David Leavitt and Charles H. Ray - Points submitted to the arbitrators for the Plaintiffs. Sgd/ S. Bartlett. (Taken from 15/10/1861 O. Corr.)"
    ]
  },
  "385": {
    "tagDate": ["1854-11-29T00:00:00.000Z"],
    "tagDescription": [
      "Newspaper Extract - New York & Erie Railroad Co.- Figures of their business for 12 months, (See Ward, Campbell & Co. Corr. 1854)."
    ]
  },
  "69": {
    "tagDate": ["1853-08-01T00:00:00.000Z"],
    "tagDescription": [
      "Newspaper Extract - Financial Affairs - (Taken from 2/8/1853 O. Corr.)"
    ]
  },
  "1262": {
    "tagDescription": [
      "Newspaper Extract - Lincoln's Proclamation repudiating the Emancipation Proclamation of General Hunter. (Taken from 20/5/1862 L. & Co. Corr.)"
    ],
    "tagDate": ["1862-05-20T00:00:00.000Z"]
  },
  "1240": {
    "tagDescription": [
      "Newspaper Extract - Official Order in respect to Military Intelligence by Telegraph, Mail or otherwise. Sgd/ Edwin M. Stanton, Secretary of War. (Taken from 28/2/1862 L. & Co. Corr.)"
    ],
    "tagDate": ["1862-02-25T00:00:00.000Z"]
  },
  "422": {
    "tagDate": ["1855-01-06T00:00:00.000Z"],
    "tagDescription": [
      "Suplemento a el Diario Espanol - Article on Spanish - United States relations."
    ]
  },
  "51": {
    "tagDescription": [
      "Circular - Statement of the Banks in New Orleans - Sgd/ John H. Alpuente, Secretary Board of Currency. (Taken from 30/4/1853 E.J.F. Corr.)"
    ],
    "tagDate": ["1853-07-01T00:00:00.000Z"]
  },
  "39": {
    "tagDescription": [
      "Newspaper Extract - Financial Affairs. (Taken from 19/4/1853 O. Corr.)"
    ],
    "tagDate": ["1853-05-19T00:00:00.000Z"]
  },
  "898": {
    "tagDescription": [
      "Newspaper Extract - Official notice of the Treasury inviting proposals for the one half of the United States 5% Loan - Sgd/ Howell Cobb, Secretary of the Treasury. (Taken from 29/6/1858 W.C. & Co."
    ],
    "tagDate": ["1858-06-26T00:00:00.000Z"]
  },
  "243": {
    "tagDescription": [
      "An Ordinance to aid the Baltimore and Ohio Railroad Company by a Loan of Five Millions of Dollars &c. Approved 27/12/1853; (See Ward, Campbell & Co. Corr. 1854)."
    ],
    "tagDate": ["1854-02-08T00:00:00.000Z"]
  },
  "749": {
    "tagDescription": [
      "Circular - Earnings of the Chicago and Burlington Railroad Line for October 1856 (Taken from 11/11/1856 O.)"
    ],
    "tagDate": ["1856-10-01T00:00:00.000Z"]
  },
  "1059": {
    "tagDate": ["1860-06-11T00:00:00.000Z"],
    "tagDescription": [
      "Newspaper Extract - Letter addressed to Hon. John Covode, Chairman of Committee of Investigation of House of Representatives on The Tehuantepec Contract, setting forth his case. Sgd/ Ellwood Fisher. (Taken from 11/6/1860 A.D.M. Corr.)"
    ]
  },
  "352": {
    "tagDate": ["1854-08-22T00:00:00.000Z"],
    "tagDescription": [
      "Newspaper Extract - Advance in Railroad Fare and Freight. (Taken from 22/8/1854 O. Corr.)"
    ]
  },
  "1200": {
    "tagDate": ["1861-11-05T00:00:00.000Z"],
    "tagDescription": [
      "Newspaper Extract - The City of Washington - (Taken from 5/11/1861 L. & Co. Corr.)"
    ]
  },
  "962": {
    "tagDate": ["1859-05-14T00:00:00.000Z"],
    "tagDescription": [
      "Newspaper Extract - Our Intercolonial Policy - The condition of Mexico - Interests of Great Britain in Mexico in no respect adverse to the United States. (Taken from 16/5/1859 A.D.M. Corr.)"
    ]
  },
  "1024": {
    "tagDate": ["1860-02-01T00:00:00.000Z"],
    "tagDescription": [
      "Parliamentary Return - Great Britain - Returns relating to Tariffs of Foreign Countries - 1858 and 1859 - List of countries included in this return: Russia, Zollverein, Wurtemberg, France, Portugal, Austria, Tuscany, Rome, Two Sicilies, Hayti, Brazil, Argentine Republic, Chili."
    ]
  },
  "180": {
    "tagDescription": [
      "Newspaper Extract - Baltimore and Ohio Railroad - Report of the Joint Committee of the City Council. (Taken from 29/11/1853 O. Corr.)"
    ],
    "tagDate": ["1853-11-29T00:00:00.000Z"]
  },
  "163": {
    "tagDate": ["1853-10-29T00:00:00.000Z"],
    "tagDescription": ["Statement of the Banks in New Orleans."]
  },
  "875": {
    "tagDate": ["1858-03-01T00:00:00.000Z"],
    "tagDescription": [
      "Pamphlet - Supreme Judicial Court - Wm. H. Swift et at in equity vs David Leavitt et al."
    ]
  },
  "319": {
    "tagDate": ["1854-05-15T00:00:00.000Z"],
    "tagDescription": [
      "Newspaper Extract - The Railway Bond List. (Taken from 16/5/1854 W., C. & Co. Corr.)"
    ]
  },
  "553": {
    "tagDescription": [
      "Prospectus - Jucaro Railroad Company in the Island of Cuba."
    ],
    "tagDate": ["1855-01-01T00:00:00.000Z"]
  },
  "1120": {
    "tagDescription": [
      "New York Express - Editorial correspondence - Interview with General Scott. (Taken from 30/7/1861 L. & Co.)"
    ],
    "tagDate": ["1861-07-24T00:00:00.000Z"]
  },
  "809": {
    "tagDate": ["1857-11-01T00:00:00.000Z"],
    "tagDescription": [
      "Newspaper Extract - Circular addressed to the Stockholders in the Michigan Central Railroad Company - Sgd/ J.W. Brooks, President. (Taken from 3/10/1857 W.C. & Co. Corr.)"
    ]
  },
  "140": {
    "tagDate": ["1853-10-05T00:00:00.000Z"],
    "tagDescription": [
      "Letter of W.C. Smedes on the subject of Union Bank Bonds, in reply to published Letter on Hon. E.C. Wilkinson."
    ]
  },
  "1226": {
    "tagDescription": [
      "Newspaper Extract - The North West Recalcitrant - Extracts from the Address of the Hon. T.A. Hendricks, President of the Democratic State Convention at Indianapolis. (Taken from 17/2/1862 L. & Co. Corr.)"
    ],
    "tagDate": ["1862-02-17T00:00:00.000Z"]
  },
  "1193": {
    "tagDate": ["1861-10-25T00:00:00.000Z"],
    "tagDescription": [
      "Newspaper Extract - Judge Merrick under surveillance - Highly interesting and important proceedings growing out of the arrest of Judge Merrick. (Taken from 25/10/1861 L. & Co. Corr.)"
    ]
  },
  "1012": {
    "tagDate": ["1860-01-03T00:00:00.000Z"],
    "tagDescription": [
      "Newspaper Extract - Re. Inter-Continental Policy. (Taken from 3/1/1860 A.D.M. Corr.)"
    ]
  },
  "1106": {
    "tagDate": ["1861-06-30T00:00:00.000Z"],
    "tagDescription": [
      "Newspaper Extract - Two widely different reports of the skirmish at Frankfort, showing the unreliability of reports of engagements. (Taken from 2/7/1861 L. & Co. Corr.)"
    ]
  },
  "789": {
    "tagDate": ["1857-06-10T00:00:00.000Z"],
    "tagDescription": [
      "The Royal Gazette - (Fredericton, N.B.) The Lt. Governor accepts the resignations of the Executive Councillors, Provincial Secretary, &c. - Provincial appointments - Proclamation of prorogation - Sale of Crown Lands &c. (Taken from Package marked Canada, N.B., N.S. & Quebec City.)"
    ]
  },
  "260": {
    "tagDescription": [
      "Newspaper Extract - Re. payments to Mexico under the Gadsden Treaty. (Taken from 13/3/1854 O. Corr.)"
    ],
    "tagDate": ["1854-03-13T00:00:00.000Z"]
  },
  "1245": {
    "tagDate": ["1862-03-15T00:00:00.000Z"],
    "tagDescription": [
      "Daily Commercial Advertiser - Extract - The Grand Trunk Railway of Canada - A Story of Commercial Recklessness, Political Profligacy and General Bribery."
    ]
  },
  "1146": {
    "tagDescription": [
      "Newspaper Extracts - The Republic in Danger - Order of the War Department. (Taken from 19/8/1861 W.B. Reed. Corr.)"
    ],
    "tagDate": ["1861-08-19T00:00:00.000Z"]
  },
  "151": {
    "tagDescription": [
      "Newspaper Extract - Wm. C. Young, President of the Panama Railroad Company, resigned his office and is succeeded by David Hoadley, at one time Vice President of the American Exchange Bank. (Taken from 21/10/1853 O. Corr.)"
    ],
    "tagDate": ["1853-10-21T00:00:00.000Z"]
  },
  "345": {
    "tagDate": ["1854-07-25T00:00:00.000Z"],
    "tagDescription": [
      "Newspaper Clipping: The Affairs of the Michigan Central Railroad Co."
    ],
    "tagPlace": ["U.L."]
  },
  "1205": {
    "tagDate": ["1861-12-03T00:00:00.000Z"],
    "tagDescription": [
      "Newspaper Extracts - The Negroes \"Affrighted\" not \"Insubordinate\" - Extracts from various Southern papers. (Taken from 3/12/1861 L. & Co.)"
    ]
  },
  "561": {
    "tagDescription": [
      "Prospectus - Union Iron and Steel Manufacturing Company, South Carolina, United States, America."
    ],
    "tagDate": ["1855-01-01T00:00:00.000Z"]
  },
  "508": {
    "tagDescription": [
      "Newspaper Extract - Re. supply of Exchange. (Taken from 10/10/1855 \"French Order.\")"
    ],
    "tagDate": ["1855-10-14T00:00:00.000Z"]
  },
  "987": {
    "tagDescription": [
      "Newspaper Extract - United States Relations with Mexico. (Taken from 20/12/1859 A.D.M. Corr.)"
    ],
    "tagDate": ["1859-12-20T00:00:00.000Z"]
  },
  "1125": {
    "tagDescription": [
      "Newspaper Extract - Comments of different papers on the March of the Federal army towards Manassas Junction - and the probable results. (Taken from 26/7/1861 L. & Co. Corr.)"
    ],
    "tagDate": ["1861-07-26T00:00:00.000Z"]
  },
  "497": {
    "tagDescription": [
      "Daily Times (New York) - Agricultural - Prospects of the Wheat Crop. (Taken from 10/8/1855 O. Corr.)"
    ],
    "tagDate": ["1855-08-08T00:00:00.000Z"]
  },
  "458": {
    "tagDescription": [
      "Newspaper Clipping: Passage of Boston Public Library Ordinance."
    ],
    "tagDate": ["1855-03-20T00:00:00.000Z"]
  },
  "1288": {
    "tagDescription": [
      "Newspaper Extract - Headquarters' Department of the Gulf, New Orleans. General Order No. 55. Measures for the relief of the destitute. Those to be Taxed for this are divided into two lists - Schedule A. - List of Subscribers to the Million and a Quarter Loan placed in the hands of the Committee of Public Safety for the defence of New Orleans against the United States, and expended by them some $38,000. Schedule B.- List of Cotton Brokers of New Orleans who published in the Crescent, in October last, a Card advising Planters not to send Produce to New Orleans, in order to induce Foreign Intervention in behalf of the Rebellion. (Taken from 11/8/1862 E.J.F. Corr.)"
    ],
    "tagDate": ["1862-08-04T00:00:00.000Z"]
  },
  "321": {
    "tagDescription": [
      "Newspaper Extract - New York City Banks - Abstract of the daily averages, of the condition of the 56 Banks, for the week, returned 5/6/1854. (Taken from 7/6/1854 O. Corr.)"
    ],
    "tagDate": ["1854-06-07T00:00:00.000Z"]
  },
  "1271": {
    "tagDescription": [
      "Montreal Weekly Herald - The American Question - Discussion in the House of Lords and of the Commons - Latest American Telegrams &c. The Times on the effect of the war upon society in the Northern States &c."
    ],
    "tagDate": ["1862-06-28T00:00:00.000Z"]
  },
  "805": {
    "tagDescription": [
      "Newspaper Extract - Circular issued by the Directors of the Michigan Central Railroad Company to the Stockholders. (Taken from 1/10/1857 O.)"
    ],
    "tagDate": ["1857-10-01T00:00:00.000Z"]
  },
  "1137": {
    "tagDate": ["1861-08-10T00:00:00.000Z"],
    "tagDescription": [
      "Journal of Commerce - New York - Extract - Statement of public feeling in Kentucky. (Taken from 19/8/1861 L. & Co. Corr.)"
    ]
  },
  "785": {
    "tagDescription": [
      "The Times [London, Eng.] - Letter from a Correspondent re. Arrest of Englishmen on the Continent. (Taken from -/4/1857 M.)"
    ],
    "tagDate": ["1857-05-02T00:00:00.000Z"]
  },
  "1153": {
    "tagDate": ["1861-09-16T00:00:00.000Z"],
    "tagDescription": [
      "Journal of Commerce - Extract - Effect of General Fremont's proclamation concerning Slaves. (Taken from 16/9/1861 L. & Co. Corr.)"
    ]
  },
  "1063": {
    "tagDate": ["1860-09-22T00:00:00.000Z"],
    "tagDescription": [
      "Newspaper Extract - Letter to the Editor of the New York Times - The Southern Trade - Failure of Messrs. Lane, Boyce & Co. (Taken from 29/9/1860 W;C. & Co. Corr.)"
    ]
  },
  "79": {
    "tagDate": ["1853-08-23T00:00:00.000Z"],
    "tagDescription": [
      "Newspaper Extract Weekly Statement - New York City Banks - Comparative Table of the Loans, Specie, Circulation and Deposits. (Taken from 23/8/1853 O. Corr.)"
    ]
  },
  "197": {
    "tagDescription": ["Acts of the Louisiana Legislature for Loans."],
    "tagDate": ["1853-01-01T00:00:00.000Z"]
  },
  "972": {
    "tagDescription": [
      "Newspaper Extract - Article re. The Initiation of a Mexican Policy. (Taken from 13/6/1859 A.D.M. Corr.)"
    ],
    "tagDate": ["1859-06-13T00:00:00.000Z"]
  },
  "752": {
    "tagDescription": [
      "Circular - Flour, Wheat, Indian Corn, Rye, Cotton &c. Sgd/ Wotherspoon, Kingsford & Co. Brokers. (Taken from 10/12/1856 W.C. & Co. Corr.)"
    ],
    "tagDate": ["1856-12-09T00:00:00.000Z"]
  },
  "213": {
    "tagDate": ["1853-01-01T00:00:00.000Z"],
    "tagDescription": [
      "Louisiana - Report of Internal Committee as to the expediency of subscribing Stock to the different Railroads now in progress in the State with its accompanying Bill."
    ]
  },
  "1070": {
    "tagDescription": [
      "Newspaper Extract - Interesting News from Mexico. (Taken from 15/1/1861 A.D.M. Corr.)"
    ],
    "tagDate": ["1860-12-13T00:00:00.000Z"]
  },
  "936": {
    "tagDescription": [
      "Newspaper Extract - Canada Banks - New Brunswick, Canada (Ontario, Quebec) Prince Edward Island, Newfoundland - Branches and Agencies, with names of Presidents and Cashiers. (Taken from 3/12/1858 O.)"
    ],
    "tagDate": ["1858-12-03T00:00:00.000Z"]
  },
  "451": {
    "tagDate": ["1855-03-05T00:00:00.000Z"],
    "tagDescription": [
      "The Virginia Sentinel 3/3/1855 - The Board of Public Works and Selden, Withers & Co. - &c."
    ]
  },
  "1218": {
    "tagDate": ["1861-01-01T00:00:00.000Z"],
    "tagDescription": [
      "Circular - Shipping & Commercial List and New York Price Current - The New Tariff - Known as the War Revenue Tariff of 1861 - A Bill to provide increased revenue from imports, to pay the interest on the public debt and for other purposes."
    ]
  },
  "82": {
    "tagDate": ["1853-08-23T00:00:00.000Z"],
    "tagDescription": [
      "Newspaper Extract - United States Treasury - Table showing the amount of the several Depositories, subject to the draft of the United States Treasury on 26 July, the closing of the fiscal year, after paying the interest on national debt. (Taken from 23/8/1853 O. Corr.)"
    ]
  },
  "621": {
    "tagDescription": [
      "New York Daily Times - Extract - Packet Ship St. Denis Foundered - Passengers all lost - Other wrecks. (Taken from 18/1/1856 \"French Order\")"
    ],
    "tagDate": ["1856-01-18T00:00:00.000Z"]
  },
  "447": {
    "tagDescription": [
      "Newspaper Extract - Portion of Governor Matteson's Message re State Agents (Illinois). N.B.- The Message will be found 19/1/1855 P. See also 13/3/1855 P. (Taken from 20/2/1855 O. Corr.)"
    ],
    "tagDate": ["1855-02-20T00:00:00.000Z"]
  },
  "768": {
    "tagDate": ["1857-01-06T00:00:00.000Z"],
    "tagDescription": [
      "Circular - Decoppet & Co., Stock and Exchange Brokers, New York. Railroad Bonds &c."
    ]
  },
  "123": {
    "tagDate": ["1853-10-01T00:00:00.000Z"],
    "tagDescription": [
      "Canada Gazette - Appointment of Chas. E. Anderson as Deputy Receiver General of the Province of Canada."
    ]
  },
  "1121": {
    "tagDescription": [
      "Newspaper Extract - Address after the Battle of Manassas of Generals Johnston and Beauregard, to the Soldiers of the Confederate States. (Taken from 13/8/1861 W.B. Reed Corr.)"
    ],
    "tagDate": ["1861-07-25T00:00:00.000Z"]
  },
  "378": {
    "tagDescription": ["Chicago and Aurora Railroad Bond."],
    "tagDate": ["1854-10-16T00:00:00.000Z"]
  },
  "194": {
    "tagDescription": [
      "Statement of terms of Philadelphia City Loan Sgd/ Samuel J. Randall, London August 10th. 1853."
    ],
    "tagDate": ["1853-12-09T00:00:00.000Z"]
  },
  "910": {
    "tagDate": ["1858-07-05T00:00:00.000Z"],
    "tagDescription": [
      "Circular Letter, Paris - Enclosing announcement of the Bank of France - Subscription for the Bonds of Eastern, Paris, Lyons and Mediterranean, Orleans & Western Railway Companies."
    ]
  },
  "87": {
    "tagDate": ["1853-09-01T00:00:00.000Z"],
    "tagDescription": [
      "Commercial Report - Warnecken & Kirchhoff, New Orleans."
    ]
  },
  "1201": {
    "tagDate": ["1861-11-07T00:00:00.000Z"],
    "tagDescription": [
      "Newspaper Extract - Important correspondence - General Hunter repudiates the Fremont-Price Treaty, (Taken from 25/11/1861 L.& Co.Corr.)"
    ]
  },
  "68": {
    "tagDate": ["1853-07-30T00:00:00.000Z"],
    "tagDescription": [
      "Newspaper Extract - Treasury Circular respecting the buying up of the United States Stocks redeemable 1868, Sgd/ James Guthrie, Secy. of the Treasury. (Taken from 2/8/1853 O. Corr.)"
    ]
  },
  "506": {
    "tagDescription": [
      "Newspaper Extract - Flour & Meal. (Taken from 10/10/1855 \"French Order\")"
    ],
    "tagDate": ["1855-10-12T00:00:00.000Z"]
  },
  "1144": {
    "tagDescription": [
      "Newspaper Extract - The Rebel Army - List of Generals, Major Generals, Brigadier Generals - Provisional Army Generals - Strength of the Confederate Army. (Taken from 19/8/1861 L. & Co. Corr.)"
    ],
    "tagDate": ["1861-08-17T00:00:00.000Z"]
  },
  "1241": {
    "tagDescription": [
      "Correspondence of the New York Times - From Port Royal (S.C.) Public and Private Libraries seized and shipped to New York. (Taken from 28/2/1862 L. & Co. Corr.)"
    ],
    "tagDate": ["1862-02-28T00:00:00.000Z"]
  },
  "1152": {
    "tagDate": ["1861-09-12T00:00:00.000Z"],
    "tagDescription": [
      "Newspaper Extract - The Southern Sequestration - Instructions of the Attorney - General of the Confederate States. (Taken from 12/10/1861 W.C. & Co.)"
    ]
  },
  "1259": {
    "tagDescription": [
      "Newspaper Extracts - Headquarters Departments of the Gulf - General Orders, Nos. 29 - 30. Re. Confederate Notes and Bills. Sgd/ Major General Butler. (Taken from 11/8/1862 E.J.F. Corr.)"
    ],
    "tagDate": ["1862-05-16T00:00:00.000Z"]
  },
  "1000": {
    "tagDescription": [
      "Circular - The Northern Railway of Canada opened throughout in 1854 - Additional funds to the extent of £250,000 required. N.B.- On the reverse side is a Map showing the position of the Northern Railroad of Canada, and its relation to the various International Lines of communication through the Great Lake District of North America. (See 1859 Package marked Maps.)"
    ],
    "tagDate": ["1859-01-01T00:00:00.000Z"]
  },
  "733": {
    "tagDescription": [
      "Circular - Ch. Stokes & Co., Paris. (Taken from Misc. Corr.)"
    ],
    "tagDate": ["1856-07-22T00:00:00.000Z"]
  },
  "462": {
    "tagDescription": [
      "Newspaper Extract - Advertisement of unadjusted Michigan Five Million Loan Bonds. (Taken from 9/5/1855 O. Corr.)"
    ],
    "tagDate": ["1855-03-25T00:00:00.000Z"]
  },
  "1104": {
    "tagDescription": [
      "The Richmond Enquirer - Extract - Why Harper's Ferry was evacuated - The true account of the stand that was not made by the Union men on the Bridge at New Creek. (Taken from 28/6/1861 L. & Co.)"
    ],
    "tagDate": ["1861-06-24T00:00:00.000Z"]
  },
  "38": {
    "tagDescription": [
      "Newspaper Extract - The Repudiation of Mississippi - The Bond Question. (Taken from 17/5/1853 O. Corr.)"
    ],
    "tagDate": ["1853-05-17T00:00:00.000Z"]
  },
  "371": {
    "tagDate": ["1854-09-15T00:00:00.000Z"],
    "tagDescription": [
      "Circular - Sault Ste Marie Canal Laws - 1. An Act granting to the State of Michigan the right of way and a Donation of Public Land for the construction of a ship Canal around the Falls of St. Mary's in said State 26/8/1852. 2. An Act to provide for the construction of a Ship Canal around the Falls of St. Mary 5/2/1853. 3. An Act supplementary to No. 2. 12/2/1853. (Taken from 15/9/1854 O. Corr.)"
    ]
  },
  "818": {
    "tagDate": ["1857-11-02T00:00:00.000Z"],
    "tagDescription": [
      "Ledger & Transcript (Philadelphia) The Money Market. (Taken from 2/11/1857 M.)"
    ]
  },
  "938": {
    "tagDescription": [
      "Newspaper Extract - Statement of The Great Western Marine Insurance Company for the fiscal year ending 31st. December, 1858. (Taken from 25/1/1859 O.) Sgd/ Douglas Robinson, Secretary. List of Directors follows - Richard Lathers, Prest."
    ],
    "tagDate": ["1859-01-18T00:00:00.000Z"]
  },
  "1083": {
    "tagDate": ["1861-02-05T00:00:00.000Z"],
    "tagDescription": [
      "Newspaper Extract - Elections and Conventions in the Southern States to be held during February. (Taken from 5/2/1861 A.D.M. Corr.)"
    ]
  },
  "984": {
    "tagDescription": [
      "Newspaper Extract - United States Relations with Mexico. (Taken from 27/9/1859 A.D.M. Corr.)"
    ],
    "tagDate": ["1859-09-27T00:00:00.000Z"]
  },
  "147": {
    "tagDate": ["1853-10-11T00:00:00.000Z"],
    "tagDescription": [
      "Newspaper Extract - Redemption of United States Stock, from a Statement in the Washington Union. (Taken from 11/10/1853 O. Corr.)"
    ]
  },
  "423": {
    "tagDate": ["1855-01-11T00:00:00.000Z"],
    "tagDescription": [
      "The Daily Picayune - The Opelousas Railroad Report of L.E. Forstall (La;) (Taken from 27/2/1855 O. Corr.)"
    ]
  },
  "74": {
    "tagDescription": [
      "Newspaper Extract, Mississippi - The decision of the High Court of Appeals favourable to the Bondholders (Taken from 12/8/1853 O. Corr.)"
    ],
    "tagDate": ["1853-08-12T00:00:00.000Z"]
  },
  "490": {
    "tagDescription": [
      "Circular - Debts and Resources of the principal cities of the Union - Sgd/ Marie and Kanz. (Taken from 7/4/1857 O. Corr.)"
    ],
    "tagDate": ["1855-06-15T00:00:00.000Z"]
  },
  "235": {
    "tagDescription": [
      "Boston Daily Advertiser - Report on the case of Iasigi & Goddard of Boston vs. James Brown of Brown Bros. & Co. New York. (Taken from 24/1/1854 O. Corr.)"
    ],
    "tagDate": ["1854-01-24T00:00:00.000Z"]
  },
  "1013": {
    "tagDescription": [
      "Newspaper Extract - Our Inter-Continental Policy. (Taken from 17/1/1860 A.D.M. Corr.)"
    ],
    "tagDate": ["1860-01-17T00:00:00.000Z"]
  },
  "963": {
    "tagDate": ["1859-05-17T00:00:00.000Z"],
    "tagDescription": [
      "Merchants' Insurance Company, Boston - Copy of the usual Policy - from which the War clause will not be excluded except for an added premium. (Taken from 17/5/1859 O.)"
    ]
  },
  "353": {
    "tagDate": ["1854-08-25T00:00:00.000Z"],
    "tagDescription": [
      "Newspaper Extract Re negotiations between the Banks and the Erie Railroad Company. (Taken from 26/8/1854 W., C. & Co. Corr.)"
    ]
  },
  "1192": {
    "tagDate": ["1861-10-25T00:00:00.000Z"],
    "tagDescription": [
      "Newspaper Extract - The Case of Judge Merrick. (Taken from 25/10/1861 L. & Co. Corr.)"
    ]
  },
  "162": {
    "tagDescription": [
      "The Evening Picayune, New Orleans - Mississippi Bond Question. (Taken from 11/11/1853 O. Corr.)"
    ],
    "tagDate": ["1853-10-29T00:00:00.000Z"]
  },
  "931": {
    "tagDate": ["1859-05-10T00:00:00.000Z"],
    "tagDescription": [
      "Newspaper Extract - The Crisis in Mexico - Effect on the Mexican people by the recognition of the Juarez Government by the United States. Denounces the attitude of the English towards the Mexican republic. (Taken from 10/5/1859 A.D.M. Corr.)"
    ]
  },
  "626": {
    "tagDescription": [
      "Newspaper Extract (N.O.) Monetary & Financial (Taken from 10/1/1856 E.J.F. Corr.)"
    ],
    "tagDate": ["1856-02-09T00:00:00.000Z"]
  },
  "1268": {
    "tagDescription": [
      "Newspaper Extract - Interesting Correspondence with the English, French and Greek Consuls and Major-General Benj. F. Butler. (Taken from 27/6/1862 L. & Co. Corr.)"
    ],
    "tagDate": ["1862-06-11T00:00:00.000Z"]
  },
  "1130": {
    "tagDate": ["1861-07-31T00:00:00.000Z"],
    "tagDescription": [
      "Newspaper Extract - Letter from Col. S.P. Heintzelman, to Capt. James B. Fry, Asst. A.G. with a report of the engagement near Manassas. (Taken from 13/8/1861 L. & Co. Corr.)"
    ]
  },
  "811": {
    "tagDate": ["1857-10-03T00:00:00.000Z"],
    "tagDescription": [
      "Newspaper Extract - The Decision in the case of New York and New Haven spurious Railroad Stock. (Taken from 3/10/1857 W.C. & Co. Corr.)"
    ]
  },
  "819": {
    "tagDate": ["1857-11-03T00:00:00.000Z"],
    "tagDescription": [
      "Newspaper Extract (Illinois) Chance for Governor Bissell to relieve the people - Important Financial movement - Locked up Specie should come out. (Taken from 3/11/1857 O.)"
    ]
  },
  "1107": {
    "tagDate": ["1861-07-02T00:00:00.000Z"],
    "tagDescription": [
      "Newspaper Extract - The trouble in the Police Department of Baltimore - Report of interview between Deputy Marshall Gifford and General Banks. (Taken from 2/7/1861 L. & Co. Corr.)"
    ]
  },
  "939": {
    "tagDescription": [
      "Newspaper Extract - Statement of the affairs of The Atlantic Mutual Insurance Company, New York, to 31st. December 1858 - Sgd/ W. Townsend Jones - Secretary - List of Trustees - John D. Jones Presdt. (Taken from 25/1/1859 O.)"
    ],
    "tagDate": ["1859-01-24T00:00:00.000Z"]
  },
  "765": {
    "tagDate": ["1856-01-01T00:00:00.000Z"],
    "tagDescription": [
      "Prospectus - The Watertown and Madison Railroad - Sgd/ Wm. Chappell, Watertown Wm. M. Dennis Watertown et al, Directors."
    ]
  },
  "375": {
    "tagDate": ["1854-10-10T00:00:00.000Z"],
    "tagDescription": [
      "Newspaper Extract - New York and Erie Railroad, Interesting Exhibit of its Affairs - Report of Committee of Examination. Sgd/ James Brown, Thomas Tileston, D.D. Williamson, John E. Williams, Caleb O. Halstead, David Hoadley, John Gourlie, J.C. Bancroft Davis. (Taken from 17/10/1854 O. Corr.)"
    ]
  },
  "511": {
    "tagDescription": [
      "Parliamentary Return, Trade and Navigation Accounts. G.B."
    ],
    "tagDate": ["1855-10-31T00:00:00.000Z"]
  },
  "1093": {
    "tagDate": ["1861-05-05T00:00:00.000Z"],
    "tagDescription": [
      "Newspaper Extract - Resignations in the Navy - Correct list of all the resigned sea officers on the active list, of Captains, Commanders and Lieutenants, with a list of the deaths in those ranks. (Taken from L. & Co. 31/5/1861.)"
    ]
  },
  "1112": {
    "tagDate": ["1861-07-09T00:00:00.000Z"],
    "tagDescription": [
      "Newspaper Extract - Statement of the Canadian Election, - Constituency - Member - M - O - Ind. (Taken from 9/7/1861 Package marked G.T.R. 1861.)"
    ]
  },
  "1219": {
    "tagDescription": [
      "Appeal on behalf of a proposed College in the Diocese of Huron, Canada West."
    ],
    "tagDate": ["1861-01-01T00:00:00.000Z"]
  },
  "1227": {
    "tagDescription": [
      "A Poem - Our Debt - Addressed to Men of Maryland. (Taken from 17/2/1862 L. & Co. Corr.)"
    ],
    "tagDate": ["1862-02-17T00:00:00.000Z"]
  },
  "346": {
    "tagDate": ["1854-08-01T00:00:00.000Z"],
    "tagDescription": [
      "Circular - W.C. Lucy & Co. Gloucester - Exports and Imports of Flour, Grain &c."
    ]
  },
  "737": {
    "tagDescription": [
      "New York Journal of Commerce - Letter, unsigned, from Chicago, on Farming at the West. (Taken from 5/8/1856 O.)"
    ],
    "tagDate": ["1856-07-25T00:00:00.000Z"]
  },
  "698": {
    "tagDescription": [
      "Parliamentary Return - Accounts of the quantities of the Principal Articles Imported into & Exported from the United Kingdom, the British Settlements in Australia, the United States of America, the Canadian Possessions, the British West Indies and Brazil, &c."
    ],
    "tagDate": ["1856-07-11T00:00:00.000Z"]
  },
  "1289": {
    "tagDate": ["1862-08-07T00:00:00.000Z"],
    "tagDescription": [
      "Newspaper Extract - Statement of the Affairs of the Banks of New Orleans on Monday August 4, 1862. (Taken from 11/8/1862 E.J.F. Corr.)"
    ]
  },
  "646": {
    "tagDescription": [
      "Newspaper Extracts - Monetary & Financial - New Orleans Stock Market &c. (Taken from 5/5/1856 O.)"
    ],
    "tagDate": ["1856-04-25T00:00:00.000Z"]
  },
  "222": {
    "tagDate": ["1853-01-01T00:00:00.000Z"],
    "tagDescription": ["The Atlantic Telegraph - Allan's Patents."]
  },
  "1147": {
    "tagDate": ["1861-08-19T00:00:00.000Z"],
    "tagDescription": [
      "Newspaper Extract - Synopsis of the arrangement between the Northern Bankers and the Secretary of the Treasury - with editorial comments. (Taken from 19/8/1861 W.B. Reed, Corr.)"
    ]
  },
  "263": {
    "tagDescription": [
      "Newspaper Extract - Article, International Balances - Securities held abroad &c. (Taken form 13/3/1854 O. Corr.)"
    ],
    "tagDate": ["1854-03-13T00:00:00.000Z"]
  },
  "280": {
    "tagDescription": [
      "N.S. Sessional Paper. Chap. I - An Act to authorize the construction of Railways in this Province - Chap. 2. An Act to authorize a Loan for the construction of Railways within this Province."
    ],
    "tagDate": ["1854-03-31T00:00:00.000Z"]
  },
  "474": {
    "tagDate": ["1855-04-27T00:00:00.000Z"],
    "tagDescription": [
      "Newspaper Extract (Mexico) - Re establishment of a Railroad from Mexico to Tampico. (Taken from 7/7/1855 F. de P.F. Corr.)"
    ]
  },
  "942": {
    "tagDescription": [
      "Press and Tribune - Extract - The Great Fraud in the Fund Commissioner's Office, Springfield, Illinois - Taken from 22/2/1859 O.)"
    ],
    "tagDate": ["1859-02-06T00:00:00.000Z"]
  },
  "866": {
    "tagDate": ["1858-01-30T00:00:00.000Z"],
    "tagDescription": [
      "Le Journal de Québec - Rapport Annuel du Comité de l'Aqueduc - 11/1/1858. Sgd/ Hector L. Langevin, President du Departement de l'Aqueduc - Le Ministère &c. (Taken from Package marked Canada &c.)"
    ]
  },
  "1136": {
    "tagDescription": [
      "Newspaper Extract - Money Market. (Taken from 13/8/1861 W.B. Reed. Corr.)"
    ],
    "tagDate": ["1861-08-08T00:00:00.000Z"]
  },
  "427": {
    "tagDate": ["1855-01-12T00:00:00.000Z"],
    "tagDescription": [
      "Newspaper Extract - The Stock Market Failure of the Banking House of Page and Bacon of St. Louis. N.B.- See also 11/1/1855 P. (Taken from 22/1/1855 O. Corr.)"
    ]
  },
  "143": {
    "tagDate": ["1853-10-10T00:00:00.000Z"],
    "tagDescription": [
      "Circular - Pennsylvania Railroad Bonds - Sgd/ Heseltine & Powell."
    ]
  },
  "1163": {
    "tagDate": ["1861-10-04T00:00:00.000Z"],
    "tagDescription": [
      "Newspaper Extract - Showing the difficulty of bringing the different elements composing the army into order. (Taken from 8/10/1861 L. & Co. Corr.)"
    ]
  },
  "967": {
    "tagDate": ["1859-05-24T00:00:00.000Z"],
    "tagDescription": [
      "Newspaper Extract - Mexico - Much trouble there attributed to the subserviency of Mr. Otway, the British Minister, to his Spanish wife and the intrigues of the French Minister, M. Gabriac. (Taken from 24/5/1859 A.D.M. Corr.)"
    ]
  },
  "1074": {
    "tagDescription": [
      "Newspaper Extract - The Bids for the New Government Loan - Bidder - Amount - Rate of Interests. (Taken from 31/12/1860 A.D.M. Corr.)"
    ],
    "tagDate": ["1860-12-31T00:00:00.000Z"]
  },
  "203": {
    "tagDescription": ["A few words on the Tea Duties. By a Londoner."],
    "tagDate": ["1853-01-01T00:00:00.000Z"]
  },
  "354": {
    "tagDate": ["1854-09-01T00:00:00.000Z"],
    "tagDescription": [
      "Circular - American Stocks - Lombard, Odier & Co. Geneve."
    ]
  },
  "650": {
    "tagDescription": [
      "New York Times - Extract - Article, Breakers Ahead, re. recognition, officially, by the United States Government of General Walker's Government in Nicaragua. (Taken from 5/5/1856 O.)"
    ],
    "tagDate": ["1856-05-05T00:00:00.000Z"]
  },
  "1298": {
    "tagDate": ["1862-10-15T00:00:00.000Z"],
    "tagDescription": [
      "Prospectus of Hannibal & St. Joseph Railroad Co.- Plan for extricating it from its present difficulties and improving its securities. (Taken from 2/12/1862 O. Corr.)"
    ]
  },
  "1021": {
    "tagDescription": [
      "Newspaper Extract - Mexican affairs. (Taken from 31/1/1860 A.D.M. Corr.)"
    ],
    "tagDate": ["1860-01-31T00:00:00.000Z"]
  },
  "459": {
    "tagDate": ["1855-03-23T00:00:00.000Z"],
    "tagDescription": [
      "Newspaper Extract - Vermont & Massachusetts Railroad - (1) Report of Joint Committee on Railways and Canals. (2) An Act to aid the Vermont and Massachusetts Railroad Company. N.B. - See also 9/4/1855 P. (Taken from 9/4/1855 O. Corr.)"
    ]
  },
  "1140": {
    "tagDate": ["1861-08-15T00:00:00.000Z"],
    "tagDescription": [
      "Newspaper Extract - Proclamation issued by Ben McCulloch to the people of Missouri. (Taken from 27/8/1861 L. & Co. Corr.)"
    ]
  },
  "341": {
    "tagDate": ["1854-07-10T00:00:00.000Z"],
    "tagDescription": [
      "Joliet and Northern Indiana Bond for $1000 - (Model) (Taken from 28/3/1855 O. Corr.)"
    ]
  },
  "52": {
    "tagDate": ["1853-07-05T00:00:00.000Z"],
    "tagDescription": [
      "Newspaper Extract - Financial Affairs. (Taken from 5/7/1853 O. Corr.)"
    ]
  },
  "648": {
    "tagDescription": [
      "Daily Advertiser, Boston - Extract - Movements in regard to the Nicaragua Question. (Taken from 5/5/1856 O.)"
    ],
    "tagDate": ["1856-05-05T00:00:00.000Z"]
  },
  "287": {
    "tagDate": ["1854-04-07T00:00:00.000Z"],
    "tagDescription": [
      "Pamphlet - Dec. 50. Report of Committee of Finance relative to the Revenues, Liabilities, expenses &c of the Commonwealth, 1853-1854. (Taken from 7/4/1854 O. Corr.)"
    ]
  },
  "1269": {
    "tagDescription": [
      "Richmond Dispatch - Extract 23/6 (a) Address of General James Longstreet. (b) A card from Gen. Beauregard. (Taken from 27/6/1862 L. & Co. Corr.)"
    ],
    "tagDate": ["1862-06-17T00:00:00.000Z"]
  },
  "1162": {
    "tagDescription": [
      "Newspaper Extract - Reception of Mrs. Fremont at Jefferson City. (Taken from 14/10/1861 L. & Co. Corr.)"
    ],
    "tagDate": ["1861-10-02T00:00:00.000Z"]
  },
  "565": {
    "tagDate": ["1855-01-01T00:00:00.000Z"],
    "tagDescription": [
      "Prospectus - The Sunken vessels Recovery Company - (London)."
    ]
  },
  "1100": {
    "tagDescription": [
      "In Chancery - Judgment of the Court respecting the rights of Bondholders and Creditors of the Grand Trunk Railroad Company. (Taken from 20/6/1861 Package marked G.T.R.)"
    ],
    "tagDate": ["1861-06-17T00:00:00.000Z"]
  },
  "641": {
    "tagDate": ["1856-04-01T00:00:00.000Z"],
    "tagDescription": [
      "Newspaper Extract - The Money & Stock Markets &c. (Taken from 1/4/1856 W.C. & Co. Corr.)"
    ]
  },
  "396": {
    "tagDescription": [
      "Prospectus - Buffalo, Brantford & Goderich Railway Company of Canada."
    ],
    "tagDate": ["1854-01-01T00:00:00.000Z"]
  },
  "505": {
    "tagDate": ["1855-10-12T00:00:00.000Z"],
    "tagDescription": [
      "Newspaper Extract - Monetary - (Louisiana) (Taken from 24/10/1855 O. Corr.)"
    ]
  },
  "182": {
    "tagDate": ["1853-11-30T00:00:00.000Z"],
    "tagDescription": ["Copy of Bond of City of Quincy."]
  },
  "477": {
    "tagDescription": [
      "Daily Advertiser, Boston - Editorial - The Governor's veto Message - the Vermont and Massachusetts Railroad Loan. (Taken from 1/5/1855 O. Corr.)"
    ],
    "tagDate": ["1855-05-01T00:00:00.000Z"]
  },
  "537": {
    "tagDate": ["1855-11-16T00:00:00.000Z"],
    "tagDescription": [
      "Newspaper Extract - Monetary & Financial. (Taken from 27/11/1855 O. Corr.)"
    ]
  },
  "983": {
    "tagDate": ["1859-09-13T00:00:00.000Z"],
    "tagDescription": [
      "Circular - Cotton Crop of the United States - Statement and Total amount for the year ending 31st. August 1859 - Office of the Shipping and Commercial list."
    ]
  },
  "350": {
    "tagDescription": [
      "Circular - Eastern Rail Road - The Directors offer to the Stockholders the Bonds of the Company at a reduced price, in order to meet expansion expenditure. (Taken from 12/8/1854 O. Corr.)"
    ],
    "tagDate": ["1854-08-02T00:00:00.000Z"]
  },
  "424": {
    "tagDate": ["1855-01-11T00:00:00.000Z"],
    "tagDescription": [
      "Newspaper Extract - Affairs of Page and Bacon. N.B.- See also 12/1/1855 P. (Taken from 22/1/1855 O. Corr.)"
    ]
  },
  "493": {
    "tagDescription": [
      "Sketch of the Present Position of the Buffalo, Brantrod and Goderich Railway Company, West Canada."
    ],
    "tagDate": ["1855-07-01T00:00:00.000Z"]
  },
  "66": {
    "tagDescription": [
      "Newspaper Extract - Financial Affairs - (Taken from 26/7/1853 O. Corr.)"
    ],
    "tagDate": ["1853-07-26T00:00:00.000Z"]
  },
  "455": {
    "tagDescription": [
      "Newspaper Extract (Mexico) Re establishment of a line of Steamers on the Pacific. (Taken from 7/7/1855 F. de P.F. Corr.)"
    ],
    "tagDate": ["1855-03-16T00:00:00.000Z"]
  },
  "625": {
    "tagDate": ["1856-02-05T00:00:00.000Z"],
    "tagDescription": [
      "Newspaper Extract - New Orleans Money Market. (Taken from 10/1/1856 E.J.F. Corr.)"
    ]
  },
  "1258": {
    "tagDescription": [
      "Newspaper Extract - The latest War news - General Hunter's Proclamation - Editorial comment. (Taken from 16/5/1862 W.B. Reed. Corr.)"
    ],
    "tagDate": ["1862-05-16T00:00:00.000Z"]
  },
  "1076": {
    "tagDescription": [
      "Newspaper Extract - Prospects of the Mexican Republic. (Taken from 15/1/1861 A.D.M.)"
    ],
    "tagDate": ["1861-01-15T00:00:00.000Z"]
  },
  "569": {
    "tagDate": ["1855-01-01T00:00:00.000Z"],
    "tagDescription": [
      "Circular - The Trade of Toronto - Statement of the Imports and Exports to and from the Port of Toronto."
    ]
  },
  "913": {
    "tagDescription": [
      "Pamphlet - Cap. XXXII - An Act to provide for the improvement and management of the Harbour of Quebec. (Taken from 28/11/1860 - Package marked Canada &c.)"
    ],
    "tagDate": ["1858-07-24T00:00:00.000Z"]
  },
  "120": {
    "tagDate": ["1853-09-20T00:00:00.000Z"],
    "tagDescription": [
      "Newspaper Extract - The Money Market. (Taken from 20/9/1853 O. Corr.)"
    ]
  },
  "788": {
    "tagDate": ["1857-06-02T00:00:00.000Z"],
    "tagDescription": [
      "Newspaper Extract - Interesting case in Insolvency - Claim preferred by McCalmont Bros. & Co. of England against the estate of Enoch Train. (Taken from 2/6/1857 O.)"
    ]
  },
  "193": {
    "tagDescription": [
      "Newspaper Extract - Foreign Dry Goods Market - (Taken from 13/12/1853 O. Corr.)"
    ],
    "tagDate": ["1853-12-09T00:00:00.000Z"]
  },
  "781": {
    "tagDescription": [
      "Circular - New York - Flour, Meat, Indian Corn, Rye, Cotton &c. Wotherspoon, Kingsford & Co., Brokers."
    ],
    "tagDate": ["1857-02-17T00:00:00.000Z"]
  },
  "1113": {
    "tagDescription": [
      "Newspaper Extract - The New Tariff - Editorial comment. (Taken from 17/7/1861 W.C. & Co.)"
    ],
    "tagDate": ["1861-07-17T00:00:00.000Z"]
  },
  "509": {
    "tagDescription": [
      "Newspaper Extract - Re. Flour and Meal. (Taken from 10/10/1855 \"French Order.\")"
    ],
    "tagDate": ["1855-10-15T00:00:00.000Z"]
  },
  "1092": {
    "tagDescription": [
      "Newspaper Extract - Quebec - The Grand Trunk - Editorial comment on copied paragraph re .scheme submitted to government for protection of the Bondholders - (G.T.R.) (Taken from Package marked G.T.R.)"
    ],
    "tagDate": ["1861-04-04T00:00:00.000Z"]
  },
  "77": {
    "tagDate": ["1853-08-23T00:00:00.000Z"],
    "tagDescription": [
      "Newspaper Extract - An article under the caption \"A Flattering Prospect\" deals with the work of the Commissioners of the Consolidated Debt of New Orleans. (Taken from 23/8/1853 O. Corr.)"
    ]
  },
  "1134": {
    "tagDate": ["1861-08-02T00:00:00.000Z"],
    "tagDescription": [
      "Newspaper Extract - Officers of the \"Mount Vernon Ladies' Association\" re. error of attributing the vandalism practiced at Mount Vernon to rebels. (Taken from 19/8/1861 L. & Co. Corr.)"
    ]
  },
  "36": {
    "tagDescription": [
      "Newspaper Extract - Financial Affairs; (Taken from 3/5/1853 O. Corr.)"
    ],
    "tagDate": ["1853-05-03T00:00:00.000Z"]
  },
  "859": {
    "tagDate": ["1857-01-01T00:00:00.000Z"],
    "tagDescription": [
      "Memorandum Confidential and Private - Halifax and Quebec Railroad. (Taken from Package marked Canada, N.B., N.S. and Quebec City)."
    ]
  },
  "1023": {
    "tagDescription": [
      "Newspaper Extract - Our Relations with Mexico - Text of the McLane - Ocampo Treaty - Treaty of Peace and Commerce between the United States and the Mexican Republic - Supplementary articles authorizing American Intervention. (Taken from 20/2/1860 A.D.M. Corr.)"
    ],
    "tagDate": ["1860-02-20T00:00:00.000Z"]
  },
  "820": {
    "tagDescription": [
      "Newspaper Extract - Monetary & Financial - Weekly statement of the New Orleans Banks. (Taken from 15/12/1857 W.C. & Co. Corr.)"
    ],
    "tagDate": ["1857-12-05T00:00:00.000Z"]
  },
  "976": {
    "tagDescription": [
      "Newspaper Extract - The Emperor of the French and Caligula Miramon. (Taken from 21/8/1859 A.D.M. Corr.)"
    ],
    "tagDate": ["1859-08-08T00:00:00.000Z"]
  },
  "756": {
    "tagDescription": [
      "Prospectus - The Australian Land & Emigration Company, Limited."
    ],
    "tagDate": ["1856-01-01T00:00:00.000Z"]
  },
  "387": {
    "tagDate": ["1854-12-30T00:00:00.000Z"],
    "tagDescription": [
      "Commercial Advertiser - Extract - The Canals of New York - Extracts from the Report of the Senate Auditor on the Canals."
    ]
  },
  "551": {
    "tagDate": ["1855-12-31T00:00:00.000Z"],
    "tagDescription": [
      "Circular - Review of the Coal and Metal Trade of California for the year 1855. Sgd/ Wm. MacCann & Co."
    ]
  },
  "254": {
    "tagDate": ["1854-03-02T00:00:00.000Z"],
    "tagDescription": [
      "Newspaper Extract - Report on the Funded Debts of the Secretary of the Treasury. Sgd/ James Guthrie, Secretary of the Treasury. (Taken from 18/3/1854 O. Corr.)"
    ]
  },
  "1301": {
    "tagDescription": [
      "Circular - The Pittsburgh, Fort Wayne & Chicago Railroad Company. (Taken from Misc. Corr.)"
    ],
    "tagDate": ["1862-11-30T00:00:00.000Z"]
  },
  "812": {
    "tagDate": ["1857-10-10T00:00:00.000Z"],
    "tagDescription": [
      "Newspaper Extract (New Orleans) - Monetary and Financial - Bank Statement &c. (Taken from 11/10/1857 E.J.F. Corr.)"
    ]
  },
  "932": {
    "tagDescription": [
      "Newspaper Extract - Letter addressed to the Editor of the United States Railroad and Mining Register, in refutation of an article published in the London Times concerning the fraud of the American management of Russian Railways. (Taken from 4/11/1858 M.)"
    ],
    "tagDate": ["1858-11-05T00:00:00.000Z"]
  },
  "945": {
    "tagDescription": [
      "The Washington States - Extract - Is the Gulf of Mexico to become a European Lake? (Taken from 21/2/1859 A.D.M. Corr.)"
    ],
    "tagDate": ["1859-02-17T00:00:00.000Z"]
  },
  "250": {
    "tagDate": ["1854-02-14T00:00:00.000Z"],
    "tagDescription": [
      "Newspaper Extract - Illinois Central Loan - A List of the houses that participated in the Loan. (Taken from 14/2/1854 O. Corr.)"
    ]
  },
  "794": {
    "tagDescription": [
      "Newspaper Extract - The form in which the new Tariff Bill was passed. (Taken from 6/3/1857 O.)"
    ],
    "tagDate": ["1857-07-01T00:00:00.000Z"]
  },
  "1095": {
    "tagDate": ["1861-05-20T00:00:00.000Z"],
    "tagDescription": [
      "Newspaper Extract - Baltimore - Editorial comment on the probability of the immediate outbreak of Civil War. (Taken from 20/5/1861 L. & Co.)"
    ]
  },
  "1079": {
    "tagDescription": [
      "Montreal Herald and Daily Commercial Gazette - Annual Review of the Trade and Commerce of Montreal for 1860 &c. (Taken from Package marked Canada &c.)"
    ],
    "tagDate": ["1861-01-18T00:00:00.000Z"]
  },
  "540": {
    "tagDate": ["1855-11-26T00:00:00.000Z"],
    "tagDescription": [
      "Newspaper Extract - Finances of Virginia (Taken from 26/11/1855 O. Corr.)"
    ]
  },
  "1257": {
    "tagDate": ["1862-05-14T00:00:00.000Z"],
    "tagDescription": [
      "New York Express - Extract from Washington Correspondence. Contraband (Negro) matters - non-enforcement of the Laws. (Taken from 20/5/1862 L. & Co. Corr.)"
    ]
  },
  "408": {
    "tagDate": ["1855-01-01T00:00:00.000Z"],
    "tagDescription": [
      "Report of the Directors of the Illinois Central Railroad. Sgd/ Geo. Griswold et al. Also - Map, Railway Guide for Illinois."
    ]
  },
  "573": {
    "tagDate": ["1855-01-01T00:00:00.000Z"],
    "tagDescription": [
      "Newspaper Extract - Re. Pacific Mail and Nicaragua Transit Companies' adjustment of their terms for California passages, gold, freight &c."
    ]
  },
  "461": {
    "tagDate": ["1855-03-25T00:00:00.000Z"],
    "tagDescription": [
      "Newspaper Extract - Unadjusted Michigan Five Million Loan Bonds. (Taken from 10/4/1855 W., C. & Co. Corr.)"
    ]
  },
  "949": {
    "tagDescription": [
      "Newspaper Extract - Account of demonstration in Washington when the Oregon Bill was passed, thus adding a new State to the Union. (Taken from 15/3/1859 A.D.M. Corr.)"
    ],
    "tagDate": ["1859-03-15T00:00:00.000Z"]
  },
  "372": {
    "tagDescription": [
      "Circular New York Central Railroad - Report of the General Superintendent, C.C. Vibbard, dated 22/7/1854."
    ],
    "tagDate": ["1854-09-19T00:00:00.000Z"]
  },
  "762": {
    "tagDate": ["1856-01-01T00:00:00.000Z"],
    "tagDescription": [
      "Prospectus of The New Brunswick and Canada Railroad and Land Company."
    ]
  },
  "1214": {
    "tagDescription": [
      "Newspaper Extract - Mr. Seward as a Diplomatist. (Taken from 26/12/1861 W.B. Reed Corr.)"
    ],
    "tagDate": ["1861-12-26T00:00:00.000Z"]
  },
  "433": {
    "tagDate": ["1855-01-20T00:00:00.000Z"],
    "tagDescription": ["Circular - Panama Rail Road."]
  },
  "617": {
    "tagDescription": [
      "New York Tribune - Extract - The Flour Market - (Taken from 15/1/1856 \"French Order\")"
    ],
    "tagDate": ["1856-01-15T00:00:00.000Z"]
  },
  "1165": {
    "tagDescription": [
      "From the Cincinnati Enquirer - Mrs. Fremont's Letter to President Lincoln - The President's reply - General Fremont's demand for Col. Blair's Letter &c. (Taken from 8/10/1861 L. & Co. Corr.)"
    ],
    "tagDate": ["1861-10-08T00:00:00.000Z"]
  },
  "1266": {
    "tagDate": ["1862-05-30T00:00:00.000Z"],
    "tagDescription": [
      "Newspaper Extract - Arrest of Hon. Richard B. Carmichael, Judge of the Seventh Judicial District. (Taken from 30/5/1862 L. & Co. Corr.)"
    ]
  },
  "1111": {
    "tagDescription": [
      "New York Times - Extract - Peculation and Waste of Money in contracts - Congressional inquiry into the burning of the steamboat \"Cataline\" near Fortress Munro. (Taken from 8/7/1861 L. & Co. Corr.)"
    ],
    "tagDate": ["1861-07-06T00:00:00.000Z"]
  },
  "1284": {
    "tagDescription": [
      "Newspaper Extract - Arrest of the Hon. James L. Bartol, one of the Judges of the Court of Appeals of Maryland. (Taken from 1/7/1862 L. & Co. Corr.)"
    ],
    "tagDate": ["1862-07-01T00:00:00.000Z"]
  },
  "225": {
    "tagDate": ["1853-01-01T00:00:00.000Z"],
    "tagDescription": ["Newspaper Extract - Financial Affairs."]
  },
  "747": {
    "tagDate": ["1856-10-20T00:00:00.000Z"],
    "tagDescription": [
      "Circular - Comparative statement, showing the business of the Railroads of the United States for the months of September 1855-6. (Taken from 22/10/1856 O.)"
    ]
  },
  "401": {
    "tagDescription": ["Copy of Nova Scotia Bond."],
    "tagDate": ["1854-01-01T00:00:00.000Z"]
  },
  "751": {
    "tagDescription": [
      "Newspaper Extract - The Coat and Wear Dividends on Stocks - Railway Traffic for October. (Taken from 17/11/1856 W.C. & Co. Corr;)"
    ],
    "tagDate": ["1856-11-17T00:00:00.000Z"]
  },
  "971": {
    "tagDate": ["1859-06-04T00:00:00.000Z"],
    "tagDescription": [
      "Newspaper Extract - New Orleans - Monetary and Financial., (Taken from 6/6/1859 E.J.F. Corr.)"
    ]
  },
  "1108": {
    "tagDescription": [
      "Newspaper Extract - Incidents of the times - (Taken from 2/7/1861 L. & Co. Corr.)"
    ],
    "tagDate": ["1861-07-02T00:00:00.000Z"]
  },
  "314": {
    "tagDescription": [
      "Newspaper Extract - Rejection of the Gadsden Treaty - Rumours of War. (Taken from 18/4/1854 O. Corr.)"
    ],
    "tagDate": ["1854-04-18T00:00:00.000Z"]
  },
  "419": {
    "tagDescription": [
      "The Times - Money Market and City Intelligence - War News - The Sick and Wounded Fund, Letter from Scutari (Refers repeatedly to Miss Nightingale)."
    ],
    "tagDate": ["1855-01-01T00:00:00.000Z"]
  },
  "246": {
    "tagDate": ["1854-02-08T00:00:00.000Z"],
    "tagDescription": [
      "Circular Letter From Colonel Thomas Aspinwall, late Consul General of the United States in London to Baring Bros., Geo. Peabody, C.M. Lampson et al in appreciation of his services, accompanied by a service of plate."
    ]
  },
  "1091": {
    "tagDescription": [
      "Newspaper Extract - Interview between Dr. Fuller of Baltimore and President Lincoln on the importance of arresting hostilities. (Taken from 25/4/1861 L & Co.)"
    ],
    "tagDate": ["1861-04-25T00:00:00.000Z"]
  },
  "1228": {
    "tagDate": ["1862-02-19T00:00:00.000Z"],
    "tagDescription": [
      "Newspaper Extract - States Guaranteeing Confederate Bonds - Report of the Committee of Ways and Means of the Legislature of South Carolina."
    ]
  },
  "622": {
    "tagDate": ["1856-01-22T00:00:00.000Z"],
    "tagDescription": [
      "Newspaper Extract - Review of the Market, for week ending 22/1/1856. (Taken from 25/1/1856 \"French Order\")"
    ]
  },
  "115": {
    "tagDate": ["1853-09-12T00:00:00.000Z"],
    "tagDescription": [
      "Newspaper Extract - Financial Affairs. (Taken from 13/9/1853 O. Corr.)"
    ]
  },
  "452": {
    "tagDate": ["1855-03-13T00:00:00.000Z"],
    "tagDescription": [
      "Newspaper Extract - Part of a letter signed \"Your Correspondent\" making certain statements injurious to the interests of the Panama Railroad. (N.B. - The reply to this by the Chief engineer will be found under date 14/3/1855 P.) (Taken from 13/3/1855 W., C. & Co. Corr.)"
    ]
  },
  "166": {
    "tagDescription": [
      "Newspaper Extract - The Stock Market. (Taken from 8/11/1853 O. Corr.)"
    ],
    "tagDate": ["1853-11-08T00:00:00.000Z"]
  },
  "49": {
    "tagDate": ["1853-06-01T00:00:00.000Z"],
    "tagDescription": [
      "Newspaper Extract - Advertisement of Sale of $1,250,000 Bonds of the New Orleans Opelousas and Great Western Railroad (New Orleans)."
    ]
  },
  "1290": {
    "tagDescription": [
      "Newspaper Extract - New Orleans Money Market. Condensed Statement of the Banks of New Orleans - Review of the Markets. (Taken from 11/8/1862 E.J.F. Corr.)"
    ],
    "tagDate": ["1862-08-09T00:00:00.000Z"]
  },
  "322": {
    "tagDate": ["1854-06-16T00:00:00.000Z"],
    "tagDescription": [
      "Newspaper Extract - Money Market. (Taken from 16/6/1854 O. Corr.)"
    ]
  },
  "1148": {
    "tagDate": ["1861-08-24T00:00:00.000Z"],
    "tagDescription": [
      "Newspaper Extract - Letter from F.P. Blair to Hon. Edward Everett, recommending the negotiation of a secret treaty with France. (Taken from 12/9/1864) G.W.L. Corr."
    ]
  },
  "310": {
    "tagDate": ["1854-04-17T00:00:00.000Z"],
    "tagDescription": [
      "Sydney Mercantile Journal and Shipping Register - Wholesale Prices Current."
    ]
  },
  "1139": {
    "tagDescription": [
      "Newspaper Extract - Speech of Governor Sprague of Rhode Island on the opening of the extra Session of the Rhode Island Legislature. (Taken from 13/8/1861 L. & Co. Corr.)"
    ],
    "tagDate": ["1861-08-13T00:00:00.000Z"]
  },
  "978": {
    "tagDate": ["1859-08-21T00:00:00.000Z"],
    "tagDescription": [
      "Newspaper Extract - The Crisis in Mexico. (Taken from 21/8/1859 A.D.M. Corr.)"
    ]
  },
  "797": {
    "tagDate": ["1857-08-25T00:00:00.000Z"],
    "tagDescription": [
      "Circular - Ohio Life Insurance and Trust Co.- Re suspension of - Sgd/ James F. Meline & Co."
    ]
  },
  "874": {
    "tagDescription": [
      "Newspaper Extract - Extract from the opinion of the Court, deciding the liability of the Cleveland Columbus and Cincinnati Railroad Company upon the guarantee of $400m Bonds of the Pigua Company. (Taken from 23/3/1858 W.C. & Co.)"
    ],
    "tagDate": ["1858-03-23T00:00:00.000Z"]
  },
  "638": {
    "tagDate": ["1856-04-01T00:00:00.000Z"],
    "tagDescription": [
      "Indenture of Mortgage between the Hannibal and St. Joseph Railroad Company, a Corporation created by an Act of the Legislature of the State of Missouri, approved 16/2/1847 of the first part and W.H. Swift, Sidney Bartlett and John Eliot Thayer of Boston of the second part."
    ]
  },
  "152": {
    "tagDescription": [
      "Newspaper Extract - Financial - Bonds held on sale by Duncan, Sherman & Co. (Taken from 22/10/1853 W.C. & Co. Corr.)"
    ],
    "tagDate": ["1853-10-22T00:00:00.000Z"]
  },
  "466": {
    "tagDate": ["1855-04-24T00:00:00.000Z"],
    "tagDescription": [
      "Proceedings of the House of Representatives Report and Bill - Western Railroad Corporation - An Act in aid of the Western Railroad Corporation."
    ]
  },
  "953": {
    "tagDate": ["1859-04-12T00:00:00.000Z"],
    "tagDescription": [
      "Newspaper Extract - Remarks of Lord Lyons on being presented to President Buchanan by Secretary Cass - and the President's reply - (Taken from 18/4/1859 A.D.M. Corr.)"
    ]
  },
  "380": {
    "tagDate": ["1854-10-24T00:00:00.000Z"],
    "tagDescription": [
      "Circular - Report of financial affairs of the New York and Erie Railroad Co. Sgd/ Homer Ramsdell, Presdt. - dated 23/10/1854. (See Ward, Campbell & Co. Corr. 1854)"
    ]
  },
  "1286": {
    "tagDescription": [
      "Newspaper Extract - A rebel operator reads General Halleck's Despatches for four days. (Taken from 12/8/1862 L. & Co. Corr.)"
    ],
    "tagDate": ["1862-07-18T00:00:00.000Z"]
  },
  "1115": {
    "tagDate": ["1861-07-20T00:00:00.000Z"],
    "tagDescription": [
      "Newspaper Extract - Correspondence of the N.A. & United States Gazette - The Battle of Bull's Run. (Taken from 22/7/1861 W.B. Reed, Corr.)"
    ]
  },
  "119": {
    "tagDate": ["1853-09-19T00:00:00.000Z"],
    "tagDescription": [
      "Newspaper Extract - Financial Affairs. (Taken from 20/9/1853 O. Corr.)"
    ]
  },
  "1264": {
    "tagDescription": [
      "The Washington Star - Extract - The Fight at Fort Darling, James River. (Taken from 20/5/1862 L. & Co. Corr.)"
    ],
    "tagDate": ["1862-05-20T00:00:00.000Z"]
  },
  "1161": {
    "tagDate": ["1861-10-01T00:00:00.000Z"],
    "tagDescription": [
      "Newspaper Extract - Proclamation of General McClellan re. the punishment of depredators upon private property. (Taken from 8/10/1861 L. & Co. Corr.)"
    ]
  },
  "1216": {
    "tagDescription": [
      "Newspaper Extract - Comments on Dr. Sunderlands opening prayer in the Senate. (Taken from 31/12/1861 L. & Co. Corr.)"
    ],
    "tagDate": ["1861-12-30T00:00:00.000Z"]
  },
  "1250": {
    "tagDescription": [
      "Newspaper Extract - Prayer of Thanksgiving for the late Federal victories transmitted by Bishop Whittingham of the Protestant Episcopal Church of Maryland - (Taken from 4/4/1862 L. & Co. Corr.)"
    ],
    "tagDate": ["1862-04-04T00:00:00.000Z"]
  },
  "547": {
    "tagDate": ["1855-12-24T00:00:00.000Z"],
    "tagDescription": [
      "Newspaper Extract - Review of the Market for week ending December 24, 1855. (Taken from 2/1/1856 \"French Order.\")"
    ]
  },
  "91": {
    "tagDate": ["1853-09-05T00:00:00.000Z"],
    "tagDescription": [
      "Parliamentary Report - Accounts relating to Trade and Navigation of United Kingdom to September 1853."
    ]
  },
  "870": {
    "tagDate": ["1858-02-13T00:00:00.000Z"],
    "tagDescription": [
      "Morning Chronicle, Quebec - The Ministry - Comments from different newspapers on recent appointments - Contested elections - The mutiny in India - Second Siege of Cawnpore. Marriage of the Princess Royal of England with Prince Frederick William of Prussia - Annual Report of Water Works Committee (For Report in French see 30/1/1858 P.) (Taken from Package marked Canada &c.)"
    ]
  },
  "83": {
    "tagDescription": [
      "Half-yearly Report of the Directors of The St. Andrews and Quebec Railroad Company."
    ],
    "tagDate": ["1853-08-24T00:00:00.000Z"]
  },
  "631": {
    "tagDescription": [
      "The Argus, Melbourne, The Colony of Victoria - The Gold - Statistics of the Gold fields of Victoria for the year 1855 - Finance and Banking - Trade and Commerce - Imports and Exports - Fort of Melbourne &c."
    ],
    "tagDate": ["1856-02-16T00:00:00.000Z"]
  },
  "1022": {
    "tagDate": ["1860-01-31T00:00:00.000Z"],
    "tagDescription": [
      "Montreal Gazette - Supplement 15/10/1860.- condensed Statement of the Corporation of the City of Montreal's account current with the City Treasurer for the year ending 31/1/1860. (Taken from 5/11/1860 Package marked Canada &c.)"
    ]
  },
  "1123": {
    "tagDate": ["1861-07-25T00:00:00.000Z"],
    "tagDescription": [
      "Newspaper Extract - Southern account of the engagement near Manassas Junction. (Taken from 26/7/1861 L. & Co. Corr.)"
    ]
  },
  "47": {
    "tagDate": ["1853-05-01T00:00:00.000Z"],
    "tagDescription": [
      "Newspaper Extract - A recapitulation of the various enterprises for the improvement and development of the natural and commercial advantages of Louisiana."
    ]
  },
  "782": {
    "tagDate": ["1857-02-21T00:00:00.000Z"],
    "tagDescription": [
      "Newspaper Extract - Mexican Affairs. (Taken from 27/2/1857 A.D.M.)"
    ]
  },
  "53": {
    "tagDescription": [
      "An Act to authorize The Citizens' Bank of Louisiana to convert Shares secured by Mortgage into Cash Shares. Sgd/ E. Warren Moise, Speaker of House of Representatives, W.F. Griffin, Presdt. pro. tem. of the Senate. Approved 28/4/1853 - Sgd/ P.O. Herbert, Govr. Louisiana."
    ],
    "tagDate": ["1853-07-26T00:00:00.000Z"]
  },
  "991": {
    "tagDescription": [
      "Circular - (Two) - Messrs Baring Brothers & Co. and Messrs. Glyn, Mills & Co., Financial Agents in England of the Province of Canada, state that they are prepared to receive applications for the Loan of £2,800,000. (Taken from Package marked Canada &c.)"
    ],
    "tagDate": ["1859-12-31T00:00:00.000Z"]
  },
  "1203": {
    "tagDate": ["1861-11-29T00:00:00.000Z"],
    "tagDescription": [
      "Newspaper Extract - Correspondence of the Maryland News Sheet. From Alexandria - A second Bull Run in miniature. (Taken from 3/12/1861 L. & Co. Corr.)"
    ]
  },
  "118": {
    "tagDate": ["1853-09-17T00:00:00.000Z"],
    "tagDescription": [
      "Newspaper Extract - The Pacific Railroad - Thirteen Millions of Stock subscribed for - (Taken from 20/9/1853 O. Corr.)"
    ]
  },
  "481": {
    "tagDescription": [
      "The Montreal Gazette - Provincial Parliament 1/5 - Grand Trunk Railway (continued)."
    ],
    "tagDate": ["1855-05-05T00:00:00.000Z"]
  },
  "488": {
    "tagDescription": [
      "Circular - Marie & Kanz, Stock & Exchange Brokers, New York - Rail Road Bonds &c."
    ],
    "tagDate": ["1855-06-12T00:00:00.000Z"]
  },
  "946": {
    "tagDescription": [
      "New York Times - Extract - Mexican affairs. (Taken from 21/2/1859 A.D.M. Corr.)"
    ],
    "tagDate": ["1859-02-21T00:00:00.000Z"]
  },
  "1243": {
    "tagDescription": [
      "Newspaper Extract - Stock market. (Taken from 8/3/1862 W.C. & Co. Corr.)"
    ],
    "tagDate": ["1862-03-08T00:00:00.000Z"]
  },
  "574": {
    "tagDescription": [
      "Circular - Reply to a Letter in relation to certain funds collected in England by Robert Bunch. Sgd/ Managers of St. Luke's Hospital."
    ],
    "tagDate": ["1855-01-01T00:00:00.000Z"]
  },
  "1195": {
    "tagDate": ["1861-10-31T00:00:00.000Z"],
    "tagDescription": [
      "National Intelligencer - How shall Maryland be governed? (Taken from 1/11/1861 L. & Co. Corr.)"
    ]
  },
  "975": {
    "tagDate": ["1859-07-08T00:00:00.000Z"],
    "tagDescription": [
      "The Washington States - Extract - The Redemption of Mexico from Anarchy. (Taken from 19/7/1859 A.D.M. Corr.)"
    ]
  },
  "793": {
    "tagDescription": [
      "Newspaper Extract - Estimate of the Wheat Crop of the United States 1840-50-8. (Taken from 23/6/1857 O.)"
    ],
    "tagDate": ["1857-06-23T00:00:00.000Z"]
  },
  "642": {
    "tagDate": ["1856-04-01T00:00:00.000Z"],
    "tagDescription": [
      "Newspaper Extract - Mississippi and Pennsylvania censured for repudiation of their indebtedness. (Taken from 1/4/1856 O.)"
    ]
  },
  "226": {
    "tagDescription": [
      "Newspaper Extract - Breadstuffs - relative to the supplies in Europe."
    ],
    "tagDate": ["1853-01-01T00:00:00.000Z"]
  },
  "894": {
    "tagDate": ["1858-04-01T00:00:00.000Z"],
    "tagDescription": [
      "Boston Statement of Calcutta Imports. (Taken from 8/1/1858 O.)"
    ]
  },
  "777": {
    "tagDate": ["1857-01-20T00:00:00.000Z"],
    "tagDescription": [
      "Newspaper Extract - Wealth of Massachusetts. (Taken from 20/1/1857 O.)"
    ]
  },
  "367": {
    "tagDescription": [
      "Newspaper Extract - New York and Erie Railroad Company. Directors' Statement re depression in market value of the Stock and bonds of the Company - Sgd/ Homer Ramsdell, President. (Taken from 6/9/1854 O. Corr.)"
    ],
    "tagDate": ["1854-09-04T00:00:00.000Z"]
  },
  "957": {
    "tagDescription": [
      "Newspaper Extract - Remarks of Mr. Mata, envoy of the Mexican Government, to the President of the United States on presenting his letter of credence - The President's reply. (Taken from 2/5/1859 A.D.M. Corr.)"
    ],
    "tagDate": ["1859-05-02T00:00:00.000Z"]
  },
  "1210": {
    "tagDescription": [
      "Albion, New York - Extract - The Seward Despatches. (As viewed by a Loyal American) Sgd/ Valerius [W.B. Reed] (Taken from 26/12/1861 W.B. Reed  Corr.)"
    ],
    "tagDate": ["1861-12-14T00:00:00.000Z"]
  },
  "1078": {
    "tagDescription": [
      "Newspaper Extract - Mexican news - Important Circulars from the Constitutional Government to the Foreign Legations of the Republic and to the Governors of the different States, explanatory of the reasons which have caused the expulsion of the Spanish Minister, Papal Nuncio and Charge of Guatemala from Mexico. (Taken from 26/2/1861 A.D.M. Corr.)"
    ],
    "tagDate": ["1861-01-15T00:00:00.000Z"]
  },
  "823": {
    "tagDescription": [
      "Pamphlet - Letter of David Leavitt to William H. Swift in relation to services and compensation in the matter of the $1,600,000 Loan (Illinois and Michigan Canal). N.B.- A MS copy of this, with the exception of the Protest of William H. Swift may be found in Collection M 31/12/1857."
    ],
    "tagDate": ["1857-12-31T00:00:00.000Z"]
  },
  "1065": {
    "tagDate": ["1860-10-29T00:00:00.000Z"],
    "tagDescription": [
      "Newspaper Extract - The Portents of Storm - Trouble in the South should Lincoln be elected - Virginia arming. (Taken from 29/10/1860 A.D.M. Corr.)"
    ]
  },
  "1256": {
    "tagDescription": [
      "Newspaper Extract - State Treasurer of Illinois has issued a notice that all taxes must be paid in specie. (Taken from (10/5/1862 W.C. & Co. Corr.)"
    ],
    "tagDate": ["1862-05-10T00:00:00.000Z"]
  },
  "1155": {
    "tagDescription": [
      "Baltimore Sun - Letters from W.H. Seward - Alleged Treason of the Correspondent of the London Times. (See 23/9/1861 P. (Reverse side) (Taken from 24/9/1861 L. & Co. Corr.)",
      "Baltimore Sun - Extract - Decision of a Prize Question - Important opinion of Judge Giles - The Seceded States declared to be Belligerents. (Case of Schooner F.W. Johnson). (Taken from 24/9/1861 L. & Co. Corr.)"
    ],
    "tagDate": ["1861-09-23T00:00:00.000Z"]
  },
  "667": {
    "tagDate": ["1856-06-01T00:00:00.000Z"],
    "tagDescription": [
      "Circular - Addressed to the Stockholders of the Cincinnati, Hamilton & Dayton Rail Road Company. Sgd/ S;S. L'Hommedieu, Pres't."
    ]
  },
  "1280": {
    "tagDate": ["1862-06-28T00:00:00.000Z"],
    "tagDescription": [
      "Baltimore American - Extract - Affairs before Richmond - Great Battle - Evacuation of White House - General McClellan's army massed south of the Chickahoming, & c. (Taken from 1/7/1862 L. & Co. Corr.)"
    ]
  },
  "543": {
    "tagDate": ["1855-12-03T00:00:00.000Z"],
    "tagDescription": [
      "Virginia Sentinel - Alexandria, 8/12/1855) - Governor's Message to the Senate and House of Delegates of Virginia. Sgd/ Jos. Johnson. (Taken from 10/12/1855 O. Corr.)"
    ]
  },
  "335": {
    "tagDescription": [
      "Newspaper Extract - Money Market. (Taken from 24/6/1854 E.J.F. Corr.)"
    ],
    "tagDate": ["1854-06-23T00:00:00.000Z"]
  },
  "759": {
    "tagDescription": [
      "Supplément à la Circulaire de Marié & Kanz. Revue de 1856 - Situation générale du Pays &c."
    ],
    "tagDate": ["1856-01-01T00:00:00.000Z"]
  },
  "253": {
    "tagDescription": [
      "Newspaper Extract - Money Market - (Taken from 28/2/1854 O. Corr.)"
    ],
    "tagDate": ["1854-02-28T00:00:00.000Z"]
  },
  "979": {
    "tagDescription": [
      "Newspaper Extract - The Mexican question. (Taken from 21/8/1859 A.D.M. Corr.)"
    ],
    "tagDate": ["1859-08-21T00:00:00.000Z"]
  },
  "1267": {
    "tagDate": ["1862-06-09T00:00:00.000Z"],
    "tagDescription": [
      "Newspaper Extract - The Pressing Need - Re-inforcements for General McClellan with which to attack Richmond. (Taken from 9/6/1862 W.B. Reed, Corr.)"
    ]
  },
  "342": {
    "tagDate": ["1854-07-12T00:00:00.000Z"],
    "tagDescription": ["Circular - The New York Price Current."]
  },
  "950": {
    "tagDescription": [
      "Newspaper Extract - Advertisement - Proposals for $228,900 Water Stock of the City of New York. Sgd/ Robert T. Haws, Comptroller. (Taken from 24/3/1860 W.C. & Co. Corr.)"
    ],
    "tagDate": ["1859-03-22T00:00:00.000Z"]
  },
  "1191": {
    "tagDescription": [
      "Newspaper Extract - Relative to order given by the Commanding General forbidding the sending of War Despatches by newspaper correspondents. (Taken from 25/10/1861 L. & Co. Corr.)"
    ],
    "tagDate": ["1861-10-25T00:00:00.000Z"]
  },
  "948": {
    "tagDate": ["1859-03-07T00:00:00.000Z"],
    "tagDescription": [
      "Advertiser, Boston - Extract - The Pacific Railroad - How and where it is likely to be built. (Taken from 15/3/1859 A.D.M. Corr.)"
    ]
  },
  "941": {
    "tagDate": ["1859-01-26T00:00:00.000Z"],
    "tagDescription": [
      "The United States Mining Journal, 29/1/1859 - Extract - The Quicksilver Mines of California - The New Almaden Mining Company - Letter to the Editor, Sgd/ Goodhue & Co., enclosing the opinion of counsel giving an historical sketch of the title - Sgd/ Reverdy Johnson J.P. Benjamin J.J. Crittenden John A. Rockwell"
    ]
  },
  "165": {
    "tagDate": ["1853-11-08T00:00:00.000Z"],
    "tagDescription": [
      "Newspaper Extract - Foreign Exports &c. Table of Exports of Specie from New York to Foreign Ports 1849-1853. (Taken from 8/11/1853 O. Corr.)"
    ]
  },
  "116": {
    "tagDescription": [
      "United States Economist - Money Market. (Taken from 13/9/1853 O. Corr.)"
    ],
    "tagDate": ["1853-09-13T00:00:00.000Z"]
  },
  "1294": {
    "tagDate": ["1862-08-26T00:00:00.000Z"],
    "tagDescription": [
      "Newspaper Extract - New Orleans Money Market. (Taken from 1/9/1862 E.J.F. Corr.)"
    ]
  },
  "232": {
    "tagDate": ["1853-01-01T00:00:00.000Z"],
    "tagDescription": [
      "Circular - Nova Scotia Bonds - The amount to be borrowed - ways of expending &c. (Canada)"
    ]
  },
  "774": {
    "tagDescription": [
      "Newspaper Extract - Governor's Message to the General Assembly of the State of Illinois - State Debt &c. (Taken from 16/1/1857 O.)"
    ],
    "tagDate": ["1857-01-16T00:00:00.000Z"]
  },
  "897": {
    "tagDate": ["1858-06-22T00:00:00.000Z"],
    "tagDescription": [
      "Newspaper Extract - Advertisement - $1,490,500 Hannibal & St. Joseph Railroad Company Land Bonds. Sgd/ R.S. Watson, Treasurer of the Fiscal Agency (Taken from 22/6/1858 O.)"
    ]
  },
  "954": {
    "tagDescription": [
      "Newspaper Extract - Monetary & Financial - New Orleans Stock Market - Specie - Banks Notes &c. (Taken from 3/5/1859 O.)"
    ],
    "tagDate": ["1859-04-22T00:00:00.000Z"]
  },
  "392": {
    "tagDate": ["1854-12-31T00:00:00.000Z"],
    "tagDescription": [
      "Le Moniteur Universel (Paris) Loi, decret et arrete concernant l'emprunt de 500 millions."
    ]
  },
  "1287": {
    "tagDescription": [
      "Newspaper Extract - Letter from Richmond, Virginia, addressed to General Lee and signed Jefferson Davis, in reply to General Pope's orders. (Taken from 12/8/1862 L. & Co. Corr.)"
    ],
    "tagDate": ["1862-07-31T00:00:00.000Z"]
  },
  "405": {
    "tagDate": ["1854-01-01T00:00:00.000Z"],
    "tagDescription": ["Address to the Queen from the Commons of Nova Scotia."]
  },
  "1273": {
    "tagDescription": [
      "Montreal Weekly Herald - Mr. Howland & Mr. Galt - Comments on letter published by Mr. Galt."
    ],
    "tagDate": ["1862-06-28T00:00:00.000Z"]
  },
  "35": {
    "tagDescription": [
      "[From the New York Tribune] - Comments on Annual Report of the Champlain & St. Lawrence Company."
    ],
    "tagDate": ["1853-05-01T00:00:00.000Z"]
  },
  "1260": {
    "tagDescription": [
      "Newspaper Extract - The Fugitive Slave Law in the District of Columbia. (Taken from 20/5/1862 L. & Co. Corr.)"
    ],
    "tagDate": ["1862-05-19T00:00:00.000Z"]
  },
  "1015": {
    "tagDescription": [
      "Newspaper Extract - Our New Mexican Policy. (Taken from 17/1/1860 A.D.M. Corr.)"
    ],
    "tagDate": ["1860-01-17T00:00:00.000Z"]
  },
  "221": {
    "tagDescription": ["Newspaper Extract, Mexican Debt."],
    "tagDate": ["1853-01-01T00:00:00.000Z"]
  },
  "1151": {
    "tagDate": ["1861-09-03T00:00:00.000Z"],
    "tagDescription": [
      "Newspaper Extract - Another Military usurpation. General Dix prohibits the further payment of the Police Force. (Taken from 10/9/1861 L. & Co. Corr.)"
    ]
  },
  "437": {
    "tagDate": ["1855-02-02T00:00:00.000Z"],
    "tagDescription": ["Circular - The Panama Rail Road - dated 29/1/1855."]
  },
  "1242": {
    "tagDescription": [
      "Newspaper Extract - Reverses - Resume of the Revolutionary War. (Taken from 28/2/1862 L. & Co. Corr.)"
    ],
    "tagDate": ["1862-02-28T00:00:00.000Z"]
  },
  "1149": {
    "tagDescription": [
      "Newspaper Extract - Important Order from the War Department to suspend all intercourse with seceded states and correspondence suspended &c. Sgd/ J.C. Fremont, Maj-Genl. Commanding. (Taken from 3/9/1861 L. & Co. Corr.)"
    ],
    "tagDate": ["1861-08-29T00:00:00.000Z"]
  },
  "613": {
    "tagDate": ["1856-01-07T00:00:00.000Z"],
    "tagDescription": [
      "Circular - Panama Rail Road Company - Statement of the Income account for six months ending 31/12/1855. Sgd/ Francis Spies, Secretary. (Taken from 31/3/1856 M.)"
    ]
  },
  "1138": {
    "tagDescription": [
      "Newspaper Extract - Affairs of the Confederate States. (Taken from 13/8/1861 L. & Co. Corr.)"
    ],
    "tagDate": ["1861-08-13T00:00:00.000Z"]
  },
  "1254": {
    "tagDate": ["1862-05-06T00:00:00.000Z"],
    "tagDescription": [
      "Newspaper Extract - Thurlow Weed's paper the Albany Evening Journal is doubtful of the success of the emancipation policy. (Taken from 6/5/1862 L. & Co. Corr.)"
    ]
  },
  "1061": {
    "tagDescription": [
      "Circular - Cotton Crop of the United States - Statement and Total Amount for the year ending 31/8/1860 - Office of the Shipping and Commercial List, New York."
    ],
    "tagDate": ["1860-09-15T00:00:00.000Z"]
  },
  "228": {
    "tagDescription": [
      "Sincere Congratulations to General Lopez on retiring from the Presidency of New Grenada."
    ],
    "tagDate": ["1853-01-01T00:00:00.000Z"]
  },
  "1202": {
    "tagDate": ["1861-11-13T00:00:00.000Z"],
    "tagDescription": [
      "Baltimore Sun - Extract - Synopsis of Col. John Cochrane's address endorsed by the Secretary of War, Mr. Cameron, to his regiment announcing a \"Policy\" on Slavery. (Taken from 19/11/1861 L. & Co. Corr.)"
    ]
  },
  "1109": {
    "tagDescription": [
      "Newspaper Extract - Circular issued by the Controller of Tennessee - Sgd/ J.T. Dunlap, Controller. (Taken from 17/7/1861 W.C. & Co. Corr.)"
    ],
    "tagDate": ["1861-07-03T00:00:00.000Z"]
  },
  "465": {
    "tagDescription": [
      "Newspaper Extract - Common Council - City of New Orleans - No. 2141 - An Ordinance - creating a Fiscal Agency for the payment of bonds of the City of New Orleans and the interest thereon, &c. (Taken from 5/5/1855 E.J.F. Corr.)"
    ],
    "tagDate": ["1855-04-14T00:00:00.000Z"]
  },
  "1217": {
    "tagDescription": [
      "Newspaper Extract - (Baltimore) War and Other News - Reference to correspondence of Mr. Seward with Lord Lyons and M. Mercier re. demand of British Government for the release of Messrs. Mason & Slidell. (Taken from 31/12/1861 L. & Co. Corr.)"
    ],
    "tagDate": ["1861-12-30T00:00:00.000Z"]
  },
  "1229": {
    "tagDescription": [
      "Congressional Paper - A Bill to Construct a Ship canal for the passage of armed and naval vessels from the Mississippi River to the Lake Michigan, and for other purposes. (Taken from 11/3/1862 O. Corr.)"
    ],
    "tagDate": ["1862-02-20T00:00:00.000Z"]
  },
  "1122": {
    "tagDescription": [
      "Newspaper Extract - Western Military Items - Ben McCullough and General Price with thirty thousand men expected to attack General Siegle's Forces at Springfield. (Taken from 26/7/1861 L. & Co. Corr.)"
    ],
    "tagDate": ["1861-07-25T00:00:00.000Z"]
  },
  "1133": {
    "tagDescription": [
      "Newspaper Extract - The decision of Government to resort to the issue of Treasury notes of the denomination of five and ten dollars. (Taken from 2/8/1861 W.B. Reed Corr.)"
    ],
    "tagDate": ["1861-08-02T00:00:00.000Z"]
  },
  "1157": {
    "tagDate": ["1861-09-22T00:00:00.000Z"],
    "tagDescription": [
      "Newspaper Extract - The Fall of Lexington confirmed. Federal account of the Battle of Blue Mills. (Taken from 24/9/1861 L. & Co. Corr.)"
    ]
  },
  "191": {
    "tagDate": ["1853-12-06T00:00:00.000Z"],
    "tagDescription": [
      "Newspaper Extract - Panama Rail Road. (Taken from 6/12/1853 O. Corr.)"
    ]
  },
  "783": {
    "tagDescription": [
      "Newspaper Extract - Amendment to the Tariff Act of 1846 - An Act to amend the Act reducing the duty on imports and for other purposes, passed 30/7/1846. (Taken from 6/3/1857 O.)"
    ],
    "tagDate": ["1857-03-04T00:00:00.000Z"]
  },
  "370": {
    "tagDescription": [
      "Circular - Massachusetts State Loan. Sgd/ Jacob H. Loud, Treasurer. (Taken from 20/9/1854 O. Corr.)"
    ],
    "tagDate": ["1854-09-12T00:00:00.000Z"]
  },
  "803": {
    "tagDescription": [
      "Newspaper Extract - Re failures of John Farnum & Co, and Hacker, Lea & Co. of Philadelphia - (Taken from 22/9/1857 O.)"
    ],
    "tagDate": ["1857-09-22T00:00:00.000Z"]
  },
  "627": {
    "tagDescription": [
      "The South Australian Register, Adelaida. Summary for the Steamer Hellespont to Singapore & Overland - Political - Revenue Returns - Trade and Commerce &c."
    ],
    "tagDate": ["1856-02-12T00:00:00.000Z"]
  },
  "1278": {
    "tagDate": ["1862-06-28T00:00:00.000Z"],
    "tagDescription": [
      "Montreal Weekly Herald - Review of Montreal Markets - Money - Cattle - Grocery-Brokers' Circular - Produce and Stock, &c."
    ]
  },
  "457": {
    "tagDescription": [
      "Shipping Statistics of the Port of Liverpool 12/3/1855."
    ],
    "tagDate": ["1855-03-19T00:00:00.000Z"]
  },
  "1265": {
    "tagDate": ["1862-05-24T00:00:00.000Z"],
    "tagDescription": [
      "Newspaper Extract - Effect on Southern Army of General Butler's Order re. women of New Orleans - The Order, dated 15 May follows. (Taken from 30/5/1862 L. & Co. Corr.)"
    ]
  },
  "1281": {
    "tagDate": ["1862-06-30T00:00:00.000Z"],
    "tagDescription": [
      "Baltimore American - Extract - Contradictory rumours in relation to the condition of affairs with the Army before Richmond. (Taken from 1/7/1862 L. & Co. Corr.)"
    ]
  },
  "1114": {
    "tagDescription": [
      "Newspaper Extract - Headquarters Department, Virginia-Fairfax Court House. General Orders No. 18 - By Command of Gen. McDowell, Jas. B. Fry, Asst. A.G. (Taken from 26/7/1861 L. & Co. Corr.)"
    ],
    "tagDate": ["1861-07-18T00:00:00.000Z"]
  },
  "1211": {
    "tagDescription": [
      "Newspaper Extract - Action of the Confederate Congress in regard to Maryland. (Taken from 17/2/1862 L. & Co. Corr.)"
    ],
    "tagDate": ["1861-12-21T00:00:00.000Z"]
  },
  "266": {
    "tagDate": ["1854-03-31T00:00:00.000Z"],
    "tagDescription": [
      "United States - Report of the Finance Committee. Sgd/ J.R. MacMurdo, Chairman."
    ]
  },
  "539": {
    "tagDate": ["1855-11-22T00:00:00.000Z"],
    "tagDescription": [
      "New York Herald - Extract - Movements in wheat give rise to conjecture - Large consignments to H.A. Kelly lead to enquiries - Kelly said to be employed by Ward. (Taken from 27/11/1855 \"French Order\")"
    ]
  },
  "1166": {
    "tagDescription": [
      "Newspaper Extract - Part of Report of General Price on the Battle of Lexington. (Taken from 8/10/1861 L. & Co. Corr.)"
    ],
    "tagDate": ["1861-10-08T00:00:00.000Z"]
  },
  "1067": {
    "tagDate": ["1860-11-28T00:00:00.000Z"],
    "tagDescription": [
      "Model of Quebec Harbour Debentures for $1000. (Taken from 28/11/1860 Canada &c.)"
    ]
  },
  "670": {
    "tagDate": ["1856-06-25T00:00:00.000Z"],
    "tagDescription": [
      "Circular - In the District Court of the Twelfth Judicial District, California - Case - Martin F. Klaucke, Plaintiff vs. John Mal and Isaac Lawrence Pool, Defendants. (Taken from -/4/1857 M.)"
    ]
  },
  "374": {
    "tagDate": ["1854-10-03T00:00:00.000Z"],
    "tagDescription": [
      "Newspaper Extract - New York and New Haven Railroad - Report of the Directors to the Stockholders at their Special Meeting. (Taken from 21/9/1854 O. Corr.)"
    ]
  },
  "146": {
    "tagDate": ["1853-10-11T00:00:00.000Z"],
    "tagDescription": [
      "Newspaper Extract - Financial Affairs. (Taken from 11/10/1853 O, Corr.)"
    ]
  },
  "479": {
    "tagDate": ["1855-05-05T00:00:00.000Z"],
    "tagDescription": [
      "Newspaper Extract - State & City Credit - (Louisiana and New Orleans). (Taken from 5/5/1855 E.J.F. Corr.)"
    ]
  },
  "792": {
    "tagDate": ["1857-06-16T00:00:00.000Z"],
    "tagDescription": [
      "Circular - New York-Flour, Wheat, Indian Corn, Rye, Cotton &c. Wotherspoon, Kingsford & Co. Brokers."
    ]
  },
  "1197": {
    "tagDescription": [
      "Newspaper Extract - Account of the Battle of Ball's Bluff. (Taken from 1/11/1861 L. & Co. Corr.)"
    ],
    "tagDate": ["1861-11-01T00:00:00.000Z"]
  },
  "643": {
    "tagDate": ["1856-04-01T00:00:00.000Z"],
    "tagDescription": [
      "Richmond Examiner - Extract - Virginia and her new financial laws. (Taken from 15/4/1856 O.)"
    ]
  },
  "75": {
    "tagDescription": [
      "New York Evening Post (Extract from) - Letter from correspondent giving rather discouraging account of the present position and future prospects of The Panama Railroad. (Taken from 2/9/1853 O. Corr.)"
    ],
    "tagDate": ["1853-08-15T00:00:00.000Z"]
  },
  "810": {
    "tagDate": ["1857-11-01T00:00:00.000Z"],
    "tagDescription": [
      "Circular - To the Stockholders in the Michigan Central Railroad Company - issuing proposals for a new Loan. Sgd/ J.W. Brooks, President."
    ]
  },
  "491": {
    "tagDate": ["1855-07-31T00:00:00.000Z"],
    "tagDescription": [
      "Boston Daily Advertiser - Report of the Meeting of the Directors of the Eastern Railroad - and the result of the defalcation of the Treasurer, Wm. S. Tuckerman. (Taken from 31/7/1855 O. Corr.)"
    ]
  },
  "981": {
    "tagDate": ["1859-08-29T00:00:00.000Z"],
    "tagDescription": [
      "Newspaper Extract - Quarrel between Miramon and Marquez. Recall of the British envoy, Mr. Otway. (Taken from 13/9/1859 A.D.M. Corr.)"
    ]
  },
  "1096": {
    "tagDate": ["1861-05-21T00:00:00.000Z"],
    "tagDescription": [
      "Newspaper Extract - An Act to authorize certain Debtors to pay the amounts due by them into the Treasury of the confederate States. Sgd/ Howell Cobb President of the Congress Jefferson Davis. (Taken from 17/7/1861 W.C. & Co. Corr.)"
    ]
  },
  "822": {
    "tagDescription": [
      "Newspaper Extract - Resumption of specie payments by New York City Banks, followed by those of Boston, Albany and New-Haven. (Taken from 15/12/1857 W.C. & Co. Corr.)"
    ],
    "tagDate": ["1857-12-15T00:00:00.000Z"]
  },
  "1003": {
    "tagDate": ["1860-01-02T00:00:00.000Z"],
    "tagDescription": [
      "Circular - The Freight Market in 1859 - Sgd/ Seymour, Peacock & Co."
    ]
  },
  "988": {
    "tagDate": ["1859-12-21T00:00:00.000Z"],
    "tagDescription": [
      "Circular - The Michigan Central Railroad Company - Financial condition of the Company. Sgd/ Isaac Livermore, Treasurer. (Taken from 17/1/1860 O.)"
    ]
  },
  "179": {
    "tagDescription": [
      "Newspaper Extract - Baltimore and Ohio Railroad Loan -  Its passage by the Second Branch of the City Council. (Taken from 15/11/1853 O. & L. Corr.)"
    ],
    "tagDate": ["1853-11-15T00:00:00.000Z"]
  },
  "498": {
    "tagDate": ["1855-09-01T00:00:00.000Z"],
    "tagDescription": [
      "New Orleans Price Current - Commercial Intelligencer and Merchants' Transcript Annual Statement - Warneken & Kirchhoff's Remarks."
    ]
  },
  "542": {
    "tagDate": ["1855-11-26T00:00:00.000Z"],
    "tagDescription": [
      "Newspaper Extract - New York & Virginia Banking - Sgd/ Old Dominion. (Taken from 26/11/1855 O. Corr.)"
    ]
  },
  "475": {
    "tagDescription": [
      "Newspaper Extract - Re. the Act to aid the Vermont and Massachusetts Railroad Company which proposed to loan that Corporation the credit of the State for $1,000,000 addressed to the Speaker of the House of Representatives and Sgd/ Henry J. Gardner."
    ],
    "tagDate": ["1855-04-30T00:00:00.000Z"]
  },
  "934": {
    "tagDescription": [
      "Newspaper Extract - Letter addressed to Messrs Benson & Co., Sgd/ William Smith re. Report of Investigation instituted by London Committee of Shareholders into the affairs of the Illinois Central."
    ],
    "tagDate": ["1858-11-10T00:00:00.000Z"]
  },
  "252": {
    "tagDate": ["1854-02-17T00:00:00.000Z"],
    "tagDescription": [
      "Newspaper Extract - Copy of Treasury project of the New Tariff, before the Committee of Ways and Means in the United States House of Representatives. (Taken from 17/2/1854 O. Corr.)"
    ]
  },
  "507": {
    "tagDate": ["1855-10-12T00:00:00.000Z"],
    "tagDescription": [
      "Newspaper Extract - The Grain Market. (Taken from 10/10/1855 \"French Order.\")"
    ]
  },
  "1087": {
    "tagDate": ["1861-02-26T00:00:00.000Z"],
    "tagDescription": [
      "Newspaper Extract - Ministers of the Cabinet of the Juarez Government. (Taken from 26/2/1861 A.D.M. Corr.)"
    ]
  },
  "196": {
    "tagDescription": [
      "Newspaper Extract - Comments on the Treasury Report. (Taken from 13/12/1853 O. Corr.)"
    ],
    "tagDate": ["1853-12-13T00:00:00.000Z"]
  },
  "425": {
    "tagDescription": [
      "Circular - Michigan Central Railroad Company Report of Directors' Meeting. Sgd/ Isaac Livermore, Treasurer. (Taken from 10/2/1855 O. Corr."
    ],
    "tagDate": ["1855-01-12T00:00:00.000Z"]
  },
  "1073": {
    "tagDate": ["1860-12-14T00:00:00.000Z"],
    "tagDescription": [
      "Newspaper Extract - Commercial Matters - Sales at the Stock Exchange. (Taken from 15/12/1860 W.C. & Co. Corr.)"
    ]
  },
  "46": {
    "tagDescription": [
      "Printed Circular of R.K. Swift, Banker and dealer in Foreign and Domestic Exchange, Stocks, Bonds &c., Chicago, Illinois. (Taken from 28/5/1853 O. Corr.)"
    ],
    "tagDate": ["1853-05-28T00:00:00.000Z"]
  },
  "148": {
    "tagDescription": [
      "Newspaper Extract - Manufactures of Massachusetts - Speech of Mr. Waters. (Taken from 11/10/1853 O. Corr.)"
    ],
    "tagDate": ["1853-10-11T00:00:00.000Z"]
  },
  "382": {
    "tagDescription": [
      "Terms of Pennsylvania Rail Road Loan to complete a second track on their Line. Sgd/ J. Edgar Thompson, Presdt."
    ],
    "tagDate": ["1854-11-20T00:00:00.000Z"]
  },
  "150": {
    "tagDate": ["1853-10-21T00:00:00.000Z"],
    "tagDescription": [
      "Newspaper Extract - New York Central Railroad - Comments on its revenue since its consolidation. (Taken from 22/10/1853 W.C. & Co. Corr.)"
    ]
  },
  "504": {
    "tagDate": ["1855-10-08T00:00:00.000Z"],
    "tagDescription": [
      "Newspaper Extract - Monetary - (Louisiana) (Taken from 9/10/1855 E.J.F. Corr.)"
    ]
  },
  "1164": {
    "tagDate": ["1861-10-08T00:00:00.000Z"],
    "tagDescription": [
      "From the Philadelphia Evening Journal - The Affair at Munson's Hill. (Taken from 8/10/1861 L. & Co. Corr.)"
    ]
  },
  "817": {
    "tagDescription": [
      "Newspaper Extract - (Copied from the Philadelphia Ledger) Re investigation by the Directors of the Bank of Pennsylvania into the affairs of that institution. (Taken from 31/10/1857 W.C. & Co. Corr.)"
    ],
    "tagDate": ["1857-10-31T00:00:00.000Z"]
  },
  "937": {
    "tagDescription": [
      "Newspaper Extract - Additional particulars of the fire at Valparaiso. (Taken from 31/12/1858 O.)"
    ],
    "tagDate": ["1858-12-29T00:00:00.000Z"]
  },
  "1060": {
    "tagDate": ["1860-07-28T00:00:00.000Z"],
    "tagDescription": [
      "Newspaper Extract - Interesting from Mexico - News of the Rejection of the Treaty received - Progress of the Liberals - Miramon's Position and Prospects &c. (Taken from 20/8/1860 A.D.M. Corr.)"
    ]
  },
  "1215": {
    "tagDescription": [
      "Newspaper Extract - American indebtedness in Europe not affected by War. (Taken from 28/12/1861 W.C. & Co. Corr.)"
    ],
    "tagDate": ["1861-12-28T00:00:00.000Z"]
  },
  "1285": {
    "tagDescription": [
      "Newspaper Extract - General Lee's General Orders No. 75, after the series of battles along the Chickahoming. (Taken from 12/8/1862 L. & Co. Corr.)"
    ],
    "tagDate": ["1862-07-07T00:00:00.000Z"]
  },
  "1116": {
    "tagDate": ["1861-07-21T00:00:00.000Z"],
    "tagDescription": [
      "Newspaper Extract - Correspondence of the N.A. & United States Gazette - The Battle of Bull's Run. (Taken from 22/7/1861 W.B. Reed, Corr.)"
    ]
  },
  "154": {
    "tagDate": ["1853-10-28T00:00:00.000Z"],
    "tagDescription": [
      "Circular - Report of Sir Gaspard Le Marchant, Governor of Nova Scotia, to the Right Hon. the Duke of Newcastle, on the actual condition of the Colony. (Canada)"
    ]
  },
  "1150": {
    "tagDescription": [
      "Newspaper Extract - Proclamation of General Fremont, establishing martial law throughout the State of Missouri. (Taken from 3/9/1861 L. & Co. Corr.)"
    ],
    "tagDate": ["1861-08-31T00:00:00.000Z"]
  },
  "1261": {
    "tagDate": ["1862-05-20T00:00:00.000Z"],
    "tagDescription": [
      "Newspaper Extract - Money Market. (Taken from 21/5/1862 W.C. & Co. Corr.)"
    ]
  },
  "261": {
    "tagDescription": [
      "Newspaper Extract - Exports of Breadstuffs to Great Britain from 1/9/1853. (Taken from 13/3/1854 O. Corr.)"
    ],
    "tagDate": ["1854-03-13T00:00:00.000Z"]
  },
  "40": {
    "tagDescription": [
      "Newspaper Extract - Financial Affairs; (Taken from 24/5/1853 O. Corr.)"
    ],
    "tagDate": ["1853-05-24T00:00:00.000Z"]
  },
  "739": {
    "tagDate": ["1856-08-01T00:00:00.000Z"],
    "tagDescription": [
      "Circular - American Commercial Inquiry, Debt Collecting, & Law Agency Office - Tappan and McKillop, New York."
    ]
  },
  "141": {
    "tagDescription": [
      "United States Economist - Article \"Gorn and Gold.\" (Taken from 11/10/1853 O. Corr.)"
    ],
    "tagDate": ["1853-10-08T00:00:00.000Z"]
  },
  "1017": {
    "tagDescription": [
      "Newspaper Extract - Letter from Hon. Wm. Appleton addressed to the Boston Board of Trade re. offering the mediation of the United States in China. (Taken from 31/1/1860 A.D.M. Corr.)"
    ],
    "tagDate": ["1860-01-25T00:00:00.000Z"]
  },
  "1208": {
    "tagDate": ["1861-12-09T00:00:00.000Z"],
    "tagDescription": [
      "Newspaper Extracts - Extracts from the Message of Governor Letcher to the Legislature of Virginia. (Taken from 9/12/1861 L. & Co. Corr.)"
    ]
  },
  "620": {
    "tagDescription": [
      "New York Daily Times - Extract - The Breadstuffs, Provision, and other Produce Markets - General Agricultural Intelligence. (Taken from 18/1/1856 \"French Order\")"
    ],
    "tagDate": ["1856-01-17T00:00:00.000Z"]
  },
  "450": {
    "tagDescription": [
      "Newspaper Extract - Monetary & Financial. (Taken from 13/3/1855 W., C. & Co. Corr.)"
    ],
    "tagDate": ["1855-03-02T00:00:00.000Z"]
  },
  "429": {
    "tagDescription": [
      "Prices Current of Produce - Rio de Janeiro - Lallement & McGregor."
    ],
    "tagDate": ["1855-01-18T00:00:00.000Z"]
  },
  "448": {
    "tagDescription": [
      "Newspaper Extract - Copied from New York Tribune - Re State Agent Wadsworth and State Funds (Illinois) N.B.- See also 19/1/1855 P. & 13/3/1855 P. (Taken from 20/2/1855 O. Corr.)"
    ],
    "tagDate": ["1855-02-20T00:00:00.000Z"]
  },
  "986": {
    "tagDate": ["1859-10-04T00:00:00.000Z"],
    "tagDescription": [
      "The States - Newspaper Article - A Hapsburg and a Throne for Mexico. (Taken from 11/10/1859 A.D.M. Corr.)"
    ]
  },
  "767": {
    "tagDescription": [
      "Newspaper Extract - Toledo, Norwalk and Cleveland Railroad - Terms of consolidation."
    ],
    "tagDate": ["1856-01-01T00:00:00.000Z"]
  },
  "377": {
    "tagDate": ["1854-10-13T00:00:00.000Z"],
    "tagDescription": [
      "Newspaper Extract - Baltimore & Ohio Railroad - Official report of the business of the Road for the month of September. (Taken from 13/10/1854 O. & L. Corr.)"
    ]
  },
  "1128": {
    "tagDate": ["1861-07-30T00:00:00.000Z"],
    "tagDescription": [
      "Louisville Courier - Extract - The Reception of the news of the great victory won by the Confederate State troops at Manassas. (Taken from 30/7/1861 L. & Co. Corr.)"
    ]
  },
  "612": {
    "tagDate": ["1856-01-03T00:00:00.000Z"],
    "tagDescription": [
      "New York Daily Times - Extract - The Breadstuffs, Provision, and other Produce Markets - General Agricultural Intelligence. (Taken from 4/1/1856 \"French Order\")."
    ]
  },
  "677": {
    "tagDate": ["1856-07-02T00:00:00.000Z"],
    "tagDescription": [
      "Pamphlet - An Act to incorporate the Colonial Bank of Canada - Preamble - Application for establishment of a Bank at Toronto. (Taken from Package marked Canada, N.B., N.S. & Quebec City)."
    ]
  },
  "1094": {
    "tagDate": ["1861-05-07T00:00:00.000Z"],
    "tagDescription": [
      "Newspaper Extract - Correspondence between Hon. John A. Campbell, late Judge of the United States Supreme Court and Hon. Wm.H. Seward, laid before the Provisional Congress by President Davis. (Taken from 20/5/1861 L. & Co.)"
    ]
  },
  "1190": {
    "tagDate": ["1861-10-24T00:00:00.000Z"],
    "tagDescription": [
      "Newspaper Extract - Lord Lyons note to the Secretary of State relative to his absence from the funeral of the Hon. E.D. Baker. (Taken from 25/10/1861 L. & Co. Corr.)"
    ]
  },
  "969": {
    "tagDescription": [
      "Newspaper Extract - April earnings of the principal railroads of United States for the years 1857-8-9. (Taken from 31/5/1859 W.C. & Co. Corr.)"
    ],
    "tagDate": ["1859-05-31T00:00:00.000Z"]
  },
  "742": {
    "tagDate": ["1856-09-01T00:00:00.000Z"],
    "tagDescription": [
      "Circular - State of Missouri Six Per Cent Bonds. (Taken from 5/9/1856 Misc. Corr.)"
    ]
  },
  "1239": {
    "tagDescription": [
      "Newspaper Extract - The Rebellion - The orders of the Secretary of War, &c. (Taken from 25/2/1862 W.C. & Co. Corr.)"
    ],
    "tagDate": ["1862-02-25T00:00:00.000Z"]
  },
  "624": {
    "tagDate": ["1856-01-29T00:00:00.000Z"],
    "tagDescription": [
      "Newspaper Extract - Review of the Market, for week ending 29/1/1856. (Taken from 29/1/1856 \"French Order\")"
    ]
  },
  "454": {
    "tagDate": ["1855-03-14T00:00:00.000Z"],
    "tagDescription": [
      "Newspaper Extract - The Panama Railroad. Letter from David Hoadley, Presdt. to Editor of New York Tribune, covering a letter of even date from G.M. Totten, Chief Engineer, correcting erroneous impressions with regard to the Road. (Taken from 13/3/1855 W., C. & Co. Corr.)"
    ]
  },
  "320": {
    "tagDate": ["1854-06-06T00:00:00.000Z"],
    "tagDescription": [
      "Boston Daily Advertiser - Extract - Boston Banks - 1st weekly statement. (Taken from 7/6/1854 O. Corr.)"
    ]
  },
  "1033": {
    "tagDescription": [
      "Pamphlet - Cap. LXXII - An Act to amend the provisions of the several Acts for the Incorporation of the City of Montreal. (Taken from 5/11/1860 Package marked Canada &c.)"
    ],
    "tagDate": ["1860-05-19T00:00:00.000Z"]
  },
  "145": {
    "tagDescription": [
      "Newspaper Extract - San Francisco United States Mail Line. (Taken from 11/10/1853. O. Corr.)"
    ],
    "tagDate": ["1853-10-11T00:00:00.000Z"]
  },
  "351": {
    "tagDescription": ["Circular - American Stocks."],
    "tagDate": ["1854-08-14T00:00:00.000Z"]
  },
  "428": {
    "tagDescription": [
      "Newspaper Extract - The Stock Market controversy re. page & Bacon failure. N.B.- See also 11 & 12/1/1855 P. (Taken from 22/1/1855 O. Corr.)"
    ],
    "tagDate": ["1855-01-16T00:00:00.000Z"]
  },
  "344": {
    "tagDescription": [
      "Newspaper Extract - Baltimore & Ohio Railroad - Official Report of the business of the Road for the month of June. (Taken from 17/7/1854 O. & L. Corr.)"
    ],
    "tagDate": ["1854-07-17T00:00:00.000Z"]
  },
  "1110": {
    "tagDescription": [
      "Newspaper Extract - Prayer of Rev. Mr. Stockton, Chaplain of the House. (Taken from 8/7/1861 L. & Co. Corr.)"
    ],
    "tagDate": ["1861-07-04T00:00:00.000Z"]
  },
  "813": {
    "tagDescription": [
      "Circular Letter from the American Commercial Agency, London, England. Sgd/ Patk. Robertson, Agent. Enclosing Tappan & McKillop's American Financial Private Circular."
    ],
    "tagDate": ["1857-10-15T00:00:00.000Z"]
  },
  "449": {
    "tagDate": ["1855-02-28T00:00:00.000Z"],
    "tagDescription": [
      "Newspaper Extract - (a) An Act to regulate the payments of Interest on the Public Debt and the purchase of State Bonds 15/2/1855 (Illinois). (b) An Act to provide for the payment of such creditors of the late Republic of Texas as are comprehended in the Act of Congress of 9/9/1850. (Taken from 13/3/1855 W., C. & Co. Corr.)"
    ]
  },
  "933": {
    "tagDate": ["1858-11-05T00:00:00.000Z"],
    "tagDescription": [
      "Newspaper Extract - Redemption of Virginia 5 and 6 per cent Stock - Advertisement of the Sinking Fund notifying to pay off $240,000 past due Stock - Sgd/ J.M. Bennett, Auditor Public Accounts. (Taken from 9/11/1858 W.C. & Co.)"
    ]
  },
  "265": {
    "tagDate": ["1854-03-31T00:00:00.000Z"],
    "tagDescription": ["Province of Nova Scotia, £100 Debenture."]
  },
  "1084": {
    "tagDate": ["1861-02-26T00:00:00.000Z"],
    "tagDescription": [
      "Circular - The New Tariff Act of the United States - An Act to provide for the Payment of outstanding Treasury notes, to authorize a Loan, to regulate and fix the Duties on Imports, and for other purposes."
    ]
  },
  "340": {
    "tagDate": ["1854-07-07T00:00:00.000Z"],
    "tagDescription": [
      "Newspaper Extract - Money Market. (Taken from 14/7/1854 O. Corr.)"
    ]
  },
  "644": {
    "tagDescription": [
      "Richmond Examiner - Extract - Financial Commercial condition of Virginia. (Taken from 22/4/1856 O.)"
    ],
    "tagDate": ["1856-04-15T00:00:00.000Z"]
  },
  "1066": {
    "tagDescription": [
      "The Globe - Extract - Editorial - The New Grand Trunk Scheme. (Taken from Package marked Canada &c.)"
    ],
    "tagDate": ["1860-11-07T00:00:00.000Z"]
  },
  "1255": {
    "tagDescription": [
      "Newspaper Extract - Important Proclamation of General Hunter - Declares slaves in his Department to be free men. (Taken from 16/5/1862 W.B. Reed, Corr.)"
    ],
    "tagDate": ["1862-05-09T00:00:00.000Z"]
  },
  "237": {
    "tagDate": ["1854-01-26T00:00:00.000Z"],
    "tagDescription": [
      "Joseph & Charles Sturge, Birmingham - Present Prices of Grain &c."
    ]
  },
  "421": {
    "tagDate": ["1855-01-01T00:00:00.000Z"],
    "tagDescription": [
      "Newspaper Clipping: J.A. Mattason: Message from the Governor of the State of Illinois."
    ]
  },
  "1167": {
    "tagDate": ["1861-10-14T00:00:00.000Z"],
    "tagDescription": [
      "Newspaper Extract - Anecdote re. Mrs. Fremont, and Mr. Blair Sr., father of the P.M.G. (Taken from 14/10/1861 L. & Co. Corr.)"
    ]
  },
  "651": {
    "tagDate": ["1856-05-31T00:00:00.000Z"],
    "tagDescription": [
      "L'Industrie - Socièté Autrichienne I.R.P. Des Chemins de fer de l'Etat. Presidence de M. le Chevalier J.-C de Seiller, vice-président du Conseil d'administration."
    ]
  },
  "85": {
    "tagDate": ["1853-08-27T00:00:00.000Z"],
    "tagDescription": [
      "Newspaper Extract - Banks of the City of New York. (Taken from 31/8/1853 O. Corr.)"
    ]
  },
  "901": {
    "tagDate": ["1859-05-11T00:00:00.000Z", "1858-05-11T00:00:00.000Z"],
    "tagDescription": [
      "Circular - Mr. S.P. Bidder's Report on the State and Prospects of the Welland Railway - addressed to Thomas Brassey Esq. - (Taken from Package marked Canada &c.)",
      "Newspaper Extract - Our Intercolonial Policy - The condition of Mexico - explains that their inter-continental policy is in perfect harmony with British policy. (Taken from 16/5/1859 A.D.M. Corr.)"
    ]
  },
  "968": {
    "tagDescription": [
      "Newspaper Extract - The President recognizes the importance of sustaining the Liberal cause in Mexico. (Taken from 30/5/1859 A.D.M. Corr.)"
    ],
    "tagDate": ["1859-05-28T00:00:00.000Z"]
  },
  "864": {
    "tagDescription": [
      "Newspaper Extract - Letter from London to Editor of the New York Times on the financial standing of the house of Peabody & Co. Sgd/ George Peabody. (Taken from 10/2/1858 O.)"
    ],
    "tagDate": ["1858-01-21T00:00:00.000Z"]
  },
  "1097": {
    "tagDescription": [
      "Newspaper Extract - Proceedings in the United States District Court by Chief Justice Taney of the United States Supreme Court in the Habeas Corpus case of John Merryman. (Taken from 31/5/1861 L. & Co. Corr.)"
    ],
    "tagDate": ["1861-05-27T00:00:00.000Z"]
  },
  "1223": {
    "tagDescription": [
      "Newspaper Extract - By Special Telegram to The Montreal Gazette. Extracted from Proceedings of the Assembly re. advances to Grand Trunk Railroad. (Taken from Package marked G.T.R.)"
    ],
    "tagDate": ["1861-01-01T00:00:00.000Z"]
  },
  "476": {
    "tagDate": ["1855-05-01T00:00:00.000Z"],
    "tagDescription": [
      "Newspaper Extract - Statement of the Massachusetts State Finances. (Taken from 1/5/1855 O. Corr.)"
    ]
  },
  "149": {
    "tagDate": ["1853-10-14T00:00:00.000Z"],
    "tagDescription": [
      "Newspaper Extract - Failure of Simeon Draper, Stock and Exchange Broker. (Taken from 14/10/1853 O. Corr.)"
    ]
  },
  "763": {
    "tagDate": ["1856-01-01T00:00:00.000Z"],
    "tagDescription": [
      "Circular - An Act to revise and amend the several acts of the Legislature connected with the adjustment of the debt proper of the State (La.) and for other purposes."
    ]
  },
  "536": {
    "tagDescription": [
      "Newspaper Extract - Monetary and Financial. (Taken from 27/11/1855 O. Corr.)"
    ],
    "tagDate": ["1855-11-09T00:00:00.000Z"]
  },
  "780": {
    "tagDate": ["1857-02-02T00:00:00.000Z"],
    "tagDescription": [
      "Circular - Nova Scotia Railway Tariff - Passengers - Horses & Carriages - Miscellaneous - Sgd/ Joseph Howe, Chairman. (Taken from 26/6/1857 Package marked Canada, N.B., N.S.)"
    ]
  },
  "432": {
    "tagDate": ["1855-01-19T00:00:00.000Z"],
    "tagDescription": [
      "Daily Democrat (Chicago) - Article under the caption, Fooling the People - State Finances (Illinois) (Taken from 30/1/1855 O. Corr.)"
    ]
  },
  "1103": {
    "tagDescription": [
      "The Daily Globe, Toronto - Extract - The Grand Trunk Report at last - Astounding Disclosure - Another Robbery of $2,433,333 !!! (Taken from Package marked G.T.R.)"
    ],
    "tagDate": ["1861-06-24T00:00:00.000Z"]
  },
  "784": {
    "tagDate": ["1857-04-01T00:00:00.000Z"],
    "tagDescription": [
      "The Evening Post - Extract - The Public Works of Virginia. (Taken from 3/4/1857 O.)"
    ]
  },
  "1295": {
    "tagDescription": [
      "Newspaper Extract - New Orleans Money Market - London Money Market - Statement of the Assets and Liabilities of the Bank of Louisiana. (Taken from 1/9/1862 E.J.F. Corr.)"
    ],
    "tagDate": ["1862-08-29T00:00:00.000Z"]
  },
  "673": {
    "tagDescription": [
      "Moniteur des Intérests Matériels - Chemins de fer - Statistique des chemins de fer europeens -"
    ],
    "tagDate": ["1856-06-29T00:00:00.000Z"]
  },
  "1300": {
    "tagDate": ["1862-11-15T00:00:00.000Z"],
    "tagDescription": [
      "Newspaper Extract - Another Raid into Maryland - Jackson's Forces at Hancock &c. (Taken from 17/11/1862 L. & Co. Corr.)"
    ]
  },
  "1143": {
    "tagDate": ["1861-08-16T00:00:00.000Z"],
    "tagDescription": [
      "Newspaper Extract - Proclamation by the President. Sgd/ Abraham Lincoln. (Taken from 16/8/1861 W.C. & Co. Corr.)"
    ]
  },
  "121": {
    "tagDescription": ["Newspaper Extract - Foreign Dry Goods Market."],
    "tagDate": ["1853-09-23T00:00:00.000Z"]
  },
  "738": {
    "tagDescription": [
      "Circular - Six Per Cent Loan of the State of Ohio. Sgd/ F.M. Wright F.D. Kimball J.H. Baker Commissioners for Ohio Sinking Fund. (Taken from 3/10/1856 O.)"
    ],
    "tagDate": ["1856-08-13T00:00:00.000Z"]
  },
  "804": {
    "tagDescription": [
      "Newspaper Extract - Monetary & Financial - New Orleans Stock market - Specie - Banks Notes. (Taken from 6/10/1857 O.)"
    ],
    "tagDate": ["1857-09-25T00:00:00.000Z"]
  },
  "787": {
    "tagDescription": [
      "Newspaper Extract Boston & Vicinity - Failure of three Dry Goods Jobbing Houses. (Taken from 5/3/1857 O.)"
    ],
    "tagDate": ["1857-05-05T00:00:00.000Z"]
  },
  "211": {
    "tagDescription": ["Buenos Ayres Bondholders meeting - Resolutions of."],
    "tagDate": ["1853-01-01T00:00:00.000Z"]
  },
  "1142": {
    "tagDate": ["1861-08-16T00:00:00.000Z"],
    "tagDescription": [
      "Daily Exchange - Extract - Dissatisfaction and Disorganization among volunteers & regulars of the Federal army - Resignation of Officers &c. (Taken from 19/8/1861 L. & Co. Corr.)"
    ]
  },
  "1251": {
    "tagDescription": [
      "Newspaper Extract - The Defences of New Orleans - The Fortifications. (Taken from 4/4/1862 L. & Co. Corr.)"
    ],
    "tagDate": ["1862-04-04T00:00:00.000Z"]
  },
  "1064": {
    "tagDescription": [
      "Circular - Report of the Finance Committee addressed to His Worship, the Mayor, the Alderman and the Citizens of the City of Montreal. (Taken from 5/11/1860 Package marked Canada &c.)"
    ],
    "tagDate": ["1860-10-18T00:00:00.000Z"]
  },
  "1249": {
    "tagDescription": [
      "Commercial Advertiser - Extract - Comments on appointment of Sir A. McNab of Great Western fame to be Speaker of the Legislative Council and Mr. Turcotte of Grand Trunk Railway fame to be Speaker of the Assembly, &c."
    ],
    "tagDate": ["1862-03-22T00:00:00.000Z"]
  },
  "1238": {
    "tagDate": ["1862-02-25T00:00:00.000Z"],
    "tagDescription": [
      "Newspaper Extract - United States Note Bill - Its terms. (Taken from 25/2/1862 G.M. & Co. Corr.)"
    ]
  },
  "453": {
    "tagDate": ["1855-03-13T00:00:00.000Z"],
    "tagDescription": [
      "Newspaper Extract - Re. possible settlement of the Wadsworth and Sheldon difficulties - (Illinois). N.B.- See also 19/1/1855 P., 20/2/1855 P. (Taken from 13/3/1855 O. Corr.)"
    ]
  },
  "623": {
    "tagDescription": [
      "Newspaper Extract - The Cotton Crop for 1855-6. (Taken from 29/1/1856 O.)"
    ],
    "tagDate": ["1856-01-29T00:00:00.000Z"]
  },
  "1160": {
    "tagDescription": [
      "The Star, Washington - Extract - Severe attack upon Major-General Fremont. (Taken from 30/9/1861 L. & Co. Corr.)"
    ],
    "tagDate": ["1861-09-30T00:00:00.000Z"]
  },
  "1102": {
    "tagDate": ["1861-06-22T00:00:00.000Z"],
    "tagDescription": [
      "The Montreal Gazette - Extract - Grand Trunk Railway - Editorial comment on the Report of the Commission - (Taken from Package marked G.T.R.)"
    ]
  },
  "178": {
    "tagDate": ["1853-11-13T00:00:00.000Z"],
    "tagDescription": [
      "St. Catharines Journal - Extract - The Niagara District Bank established on the free banking law. Comments on Extract - (Taken from 13/11/1853 M. Corr.)"
    ]
  },
  "1016": {
    "tagDate": ["1860-01-17T00:00:00.000Z"],
    "tagDescription": [
      "Newspaper Extract - \"Proprieties in Social Intercourse\".  (Taken from 17/1/1860 A.D.M. Corr.)"
    ]
  },
  "1209": {
    "tagDescription": [
      "Newspaper Extracts - Synopsis of the Message of Governor Letcher to the Legislature of Virginia. (Taken from 9/12/1861 L. & Co. Corr.)"
    ],
    "tagDate": ["1861-12-09T00:00:00.000Z"]
  },
  "323": {
    "tagDate": ["1854-06-20T00:00:00.000Z"],
    "tagDescription": [
      "\"The Quartzburg Water Company,\" Incorporated March 1st. 1854, for the Development of the Permanent Resources of Mariposa County. (Cal.) P. Cadell Jr. Agent for the Company."
    ]
  },
  "510": {
    "tagDescription": [
      "Boston Daily Advertiser - Extract - Financial. (Taken from 10/10/1855 \"French Order\")"
    ],
    "tagDate": ["1855-10-15T00:00:00.000Z"]
  },
  "1154": {
    "tagDescription": [
      "Newspaper Extract - Arrests Extraordinary - Hon. Henry May, Member of Congress, Hon. Geo. Wm. Brown, Mayor of Baltimore, Delegates to the Legislature, Editors of Daily Exchange and South arrested by the Federal authorities. (Taken from 16/9/1861 L. & Co. Corr.)"
    ],
    "tagDate": ["1861-09-16T00:00:00.000Z"]
  },
  "394": {
    "tagDescription": [
      "Circular - Nova Scotia Bonds - Area, population, Revenue &c."
    ],
    "tagDate": ["1854-01-01T00:00:00.000Z"]
  },
  "1129": {
    "tagDate": ["1861-07-30T00:00:00.000Z"],
    "tagDescription": [
      "The South - Extract - Editorial - Government upon Austrian Plan - Discusses the history of the Police Commissioners of Baltimore. (Taken from 2/8/1861 L. & Co. Corr.)"
    ]
  },
  "1222": {
    "tagDate": ["1861-01-01T00:00:00.000Z"],
    "tagDescription": [
      "Newspaper Extract - Proceedings of The Assembly - Discussion re. advances made to the Grand Trunk Railroad. (Taken from Package marked Grand Trunk Railroad)"
    ]
  },
  "41": {
    "tagDescription": [
      "British Packet and Argentine News - Documents and Correspondence relative to the Blockade of the Port. Buenos Ayres."
    ],
    "tagDate": ["1853-05-28T00:00:00.000Z"]
  },
  "736": {
    "tagDate": ["1856-07-29T00:00:00.000Z"],
    "tagDescription": [
      "Circular (Pa) - The Trevorton Coal and Railroad Company. Sgd/ James L. Morris, President - List of Directors. (Taken from 29/7/1856 O.)"
    ]
  },
  "647": {
    "tagDescription": [
      "Newspaper Extract - Monetary and Financial - Weekly Statement of New Orleans Banks &c. (Taken from 5/5/1856 O.)"
    ],
    "tagDate": ["1856-04-26T00:00:00.000Z"]
  },
  "153": {
    "tagDate": ["1853-10-24T00:00:00.000Z"],
    "tagDescription": [
      "Newspaper Extract - Monetary and Commercial (Baltimore) (Taken from 24/10/1853 O. & L. Corr.)"
    ]
  },
  "48": {
    "tagDate": ["1853-06-17T00:00:00.000Z"],
    "tagDescription": [
      "Newspaper Extract - The Pacific Railroad Company - Congress appropriated $150,000 for survey of three several routes to San Francisco that a choice may be made for Railroad communication between the Mississippi and the Pacific. (Taken from 17/6/1853 O. Corr.)"
    ]
  },
  "952": {
    "tagDate": ["1859-04-08T00:00:00.000Z"],
    "tagDescription": [
      "Newspaper Extract - Monetary & Financial - New Orleans Stock Market - Specie - Banks Notes. (Taken from 19/4/1859 O.)"
    ]
  },
  "772": {
    "tagDescription": [
      "Newspaper Extract - State Debt of Illinois. (Taken from 16/1/1857 O.)"
    ],
    "tagDate": ["1857-01-16T00:00:00.000Z"]
  },
  "1291": {
    "tagDate": ["1862-08-11T00:00:00.000Z"],
    "tagDescription": [
      "Newspaper Extract - Population and Wealth of Louisiana, exclusive of the Parish of Orleans, the Parish of West Baton Rouge and Lafourche Parishes - Population - White - Slaves - Value of Slaves - Value of Property. (Taken from 11/8/1862. E.J.F. Corr.)"
    ]
  },
  "602": {
    "tagDate": ["1855-01-01T00:00:00.000Z"],
    "tagDescription": [
      "Prospectus - Colonial and General Produce and Provision Company Chief Offices - London."
    ]
  },
  "234": {
    "tagDate": ["1854-01-01T00:00:00.000Z"],
    "tagDescription": [
      "Circular - Robert Gladstone & Co., Manchester - Fluctuation in the prices of Cotton in each year from 1844-1854."
    ]
  },
  "538": {
    "tagDescription": [
      "Chicago Press - Extract - Europeans Purchasers in America - Operations in wheat of Mr. Haddack - European Agents appeared upon Change in Chicago instead of as usual in New York. (Taken from 27/11/1855 \"French Order\"."
    ],
    "tagDate": ["1855-11-19T00:00:00.000Z"]
  },
  "1194": {
    "tagDescription": [
      "Newspaper Extract - The Two Armies. (Taken from 1/11/1861 L. & Co. Corr.)"
    ],
    "tagDate": ["1861-10-30T00:00:00.000Z"]
  },
  "1090": {
    "tagDescription": [
      "The Tribune, Philadelphia - Extract - The Situation - The present posture of affairs in and about Washington. (Taken from 25/4/1861 W.B. Reed)"
    ],
    "tagDate": ["1861-04-24T00:00:00.000Z"]
  },
  "985": {
    "tagDate": ["1859-09-30T00:00:00.000Z"],
    "tagDescription": [
      "The States - Re. hostilities by China against England and France. (Taken from 11/10/1859 A.D.M. Corr.)"
    ]
  },
  "478": {
    "tagDate": ["1855-05-04T00:00:00.000Z"],
    "tagDescription": [
      "Newspaper Extract - Monetary and Financial (Louisiana) (Taken from 5/5/1855 E.J.F. Corr.)"
    ]
  },
  "503": {
    "tagDate": ["1855-09-04T00:00:00.000Z"],
    "tagDescription": [
      "Circular, New York - Breadstuffs, Cotton &c - Wotherspoon, Kingsford & Co. Brokers. (Taken from 4/9/1855 G. & Co. Corr.)"
    ]
  },
  "1032": {
    "tagDescription": [
      "Newspaper Extract - The condition of Mexico consequent upon the continued delay in the ratification of the American Treaty. (Taken from 14/5/1860 A.D.M. Corr.)"
    ],
    "tagDate": ["1860-05-14T00:00:00.000Z"]
  }
}
